,created,id,content,num_comments,score,type,post_affiliation,month,year,sentiment
251,1/9/2023 1:26,j7anfdh,"Pc player, my planned build for duels and pve clear

Lvl 5: Incendio mastery 
Lvl 6: depulso mastery 
Lvl 7: swift
Lvl 8: basic cast mastery
Lvl 9: spell knowledge 1
Lvl 10: blood curse
Lvl 11: spell knowledge 2
Lvl 12: protego absorption 

save points 

Lvl 16: spell knowledge 3
Lvl 16: Crucio mastery 
Lvl 16: enduring curse
Lvl 16: protego expertise  

save points 

Lvl 22: avada kedavra mastery 
Lvl 22: curse sapper 
Lvl 22: protego mastery  

remaining points ur choice, any thoughts appreciated thanks",,3,comment,10tzh71,5,2023,neutral
252,1/9/2023 15:35,j7dcxdo,"1st for the people saying this Reddit and comments are all positive huh? Are you in the same one? I see plenty with a few negatives. 

2nd. Everyone please please remember this is a video game RPG like so many others before. This is not gonna be a flawless perfect game. Manage your expectations. There will be a few bugs. It won't be this perfect HP simulation full of every single thing the franchise has to offer. Don't expect that you'll be letting yourself down. 

3rd. Enjoy it. It's a video game. You suppose to have fun not pick it apart. Also there will be patches and changes after its release. Still just remember the fun part",,7,comment,10ud8wx,6,2023,neutral
253,2/9/2023 3:20,j7bcnpy,"aside from a few pop ins i caught during someones stream (assuming that gets fixed with the day 1 patch on release), everything seemed smooth enough and i was really impressed with the first handful of hours of the game!!",,76,comment,10ud8wx,5,2023,positive
254,13/2/2023 22:47,j7botta,[deleted],,-21,comment,10ud8wx,6,2023,neutral
255,2/9/2023 12:36,j7cifb7,Map is a bit weird to navigate and potions take time to make (which is immersive?),,1,comment,10ud8wx,6,2023,negative
256,2/9/2023 9:22,j79nlcw,"I mean, if people's only issue with this game is the fact that you can't sit, it's a win.",,3,comment,10tod6j,5,2023,positive
257,2/9/2023 10:00,j78kjmu,I do agree with this but a lot of times it’s the little details in games that make it so great,,80,comment,10tod6j,5,2023,neutral
258,2/8/2023 23:32,j78zdah,Unplayable.  I'm refunding.,,7,comment,10tod6j,5,2023,negative
259,2/9/2023 7:14,j780pzj,The really big question... can we sleep to make time skip forward?,,6,comment,10tod6j,5,2023,neutral
260,2/8/2023 23:13,10uj838,PSA: Be careful and listen to your body.,346,663,post,,6,2023,neutral
261,2/9/2023 0:40,j7fc1r0,Love this game already,,1,comment,10uh2kr,6,2023,positive
262,2/9/2023 0:25,j7edzla,Real reason not to take divination: the bloody everest expedition from the dungeons to the tower after double potions. No thanks.,,2,comment,10uh2kr,6,2023,neutral
263,2/9/2023 6:03,j7bu621,Nah I would be talking my broom with me or at least leviosa up the stairs 😅,,6,comment,10uh2kr,6,2023,neutral
264,2/9/2023 8:36,j7byyt5,"What do you think, why does Mr. Filch have lung-problems and troubles with nerves?",,5,comment,10uh2kr,6,2023,neutral
265,2/8/2023 23:20,j7cc638,Uhhh this is cringe.,,26,comment,10uj838,6,2023,negative
266,2/9/2023 13:22,j7c40y0,20g of chronic and 2 cases of beer for me! Let's gooooooo.,,287,comment,10uj838,6,2023,positive
267,2/9/2023 10:51,j7cde7i,"Being a guy who doesn't work in the EMS field, remember to breathe guys! PLEASE PLEASE PLEASE don't hold your breath for multiple hours whilst you game! Non-paramedics like me hate to see people die from forgetting to breathe so PLEASE breathe at least sometimes.

Don't let games dictate whether you breathe or not!",,10,comment,10uj838,6,2023,neutral
268,2/8/2023 23:12,j7cay2k,uh...thanks? lol,,12,comment,10uj838,6,2023,neutral
269,2/9/2023 19:00,j7fuu2h,"I do the New Zealand trick with lots of the new releases I'm interested in, and I was all hyped to do it with HL but then realized I had all this Playstation Store credit to spend, lol. So I'll be playing tomorrow.

Enjoy, virtual kiwis! I'm with you in spirit.",,3,comment,10uyuf6,6,2023,positive
270,2/9/2023 5:05,j7fnwvz,"https://preview.redd.it/eryfl7x04mga1.png?width=3024&format=png&auto=webp&v=enabled&s=362fd589570b862463ea33fbd1cb81c5e4951345

Sure is nice this time of year just flew in haha",,16,comment,10uyuf6,6,2023,neutral
271,2/9/2023 12:09,j7gr5fg,This is literally the only thing I miss about having an Xbox. Stupid playstation!,,1,comment,10uyuf6,7,2023,neutral
272,2/9/2023 13:49,j7ge0gn,I did it and it worked and I’m playing. Should I wait till it actually releases in my time zone to switch back?,,1,comment,10uyuf6,7,2023,neutral
273,2/9/2023 4:00,j7ccj08,I doubt that's even remotely possible. There are 4 stealth talents only. Not to mention it's already op without any potion.,,2,comment,10uhq08,6,2023,neutral
274,2/9/2023 18:03,j7cbyvg,"Amatuer im 360 no scoping stupify from the top of hogwartz, noob",,32,comment,10uhq08,6,2023,neutral
275,2/9/2023 8:56,j7de9kr,![gif](giphy|Gyb7Mrx7jlGF2),,3,comment,10uhq08,6,2023,neutral
276,1/9/2023 5:09,j7f18d4,What a thrill.,,2,comment,10uhq08,6,2023,positive
277,2/9/2023 1:40,j7ssx2e,"https://preview.redd.it/3re7o5u8k4ha1.jpeg?width=3024&format=pjpg&auto=webp&v=enabled&s=4817cb004a08269dd117f7ae1c4d3e6a27b5fdc4

Evelyn Primrose! This is my Ravenclaw. She’s seen some shit, but still retains her curiosity and enthusiasm for learning. Generally kind, but can be savage when needed.",,24,comment,10v2fic,9,2023,neutral
278,2/9/2023 12:29,j7fzvr8,"Name: Neville Powerbottom 

TBD on everything else I just have been laughing at my name for a week now since I thought of it",,618,comment,10v2fic,6,2023,neutral
279,2/9/2023 5:09,j8ccxud,"&#x200B;

https://preview.redd.it/20cgj85dzxha1.png?width=1944&format=png&auto=webp&v=enabled&s=8748aa5646f38247c94024bfc5d60ad22b3dae28

Not sure which game I'm playing.",,20,comment,10v2fic,2,2023,neutral
280,2/9/2023 20:46,j7jhf3t,"Hello fellow class mates[https://imgur.com/a/GWg9Z0R](https://imgur.com/a/GWg9Z0R)

Elizabeth Frost ""Lizzy"" for short. A girl with a cheerful disposition, very curious, clumsy.

Gryffindor",,20,comment,10v2fic,7,2023,neutral
281,2/9/2023 12:48,10vh8iq,"Wrap yourself in Merlin's Cloak by obtaining this exclusive Twitch Drop, available to unlock only through watching the official #HogwartsLegacy Launch Week Livestreams on twitch...",369,703,post,,7,2023,neutral
282,2/9/2023 6:53,10vnm70,PC Players don't give up hope,263,453,post,,7,2023,positive
283,2/9/2023 11:33,j7kshlq,"I feel called out, lol",,101,comment,10vzfzl,7,2023,negative
284,2/9/2023 13:23,j7m6r36,"Yess, and the extra five minutes of trying to shoot professor fig🫣",,2,comment,10vzfzl,8,2023,neutral
285,2/9/2023 6:17,j7lhbjo,Had to use repairo on my brain to understand the title. But yes same especially when I realized you don’t have to click the right trigger down all the way to cast,,29,comment,10vzfzl,8,2023,neutral
286,2/9/2023 10:44,j7l07hy,Lmao attacked.,,3,comment,10vzfzl,7,2023,neutral
287,2/9/2023 6:13,j7hn7q8,earn these drops by watching a livestream full of spoilers in a story driven game,,100,comment,10vh8iq,7,2023,negative
288,2/9/2023 6:52,j7id3vf,I watched on mobile and didn’t unlock anything…,,2,comment,10vh8iq,7,2023,neutral
289,2/9/2023 21:18,j7hoche,Can you get all the drops just by watching the Avalanche stream or only the Merlin robe?,,11,comment,10vh8iq,7,2023,neutral
290,2/9/2023 21:22,j7kubep,"Still find it funny that they are starting a twitch drop, 2 hours before PC release actually unlocks ha",,3,comment,10vh8iq,7,2023,positive
291,2/9/2023 9:22,j39a7kq,nO tRAnSfiGuRation!? iM nOT imMerSed (you know who y’all are 😭😂),,6,comment,1054n50,7,2023,negative
292,2/9/2023 21:04,j3nrs7o,Nothing for your average Arithmancy enjoyer?,,0,comment,1054n50,10,2023,neutral
293,2/9/2023 23:07,j39ew7x," 
SoP trailer also mentioned Beast class tho, hasn’t really been talked about since iirc",,12,comment,1054n50,7,2023,neutral
294,2/9/2023 22:25,j3aa6eb,I mean we already knew lol,,3,comment,1054n50,7,2023,neutral
295,2/9/2023 8:53,j7ihtu8,"same

https://preview.redd.it/6svpl1b7ipga1.png?width=1265&format=png&auto=webp&v=enabled&s=cb80b3c92b65a8d52d416b51791624dd685e8da3",,31,comment,10vnlga,7,2023,neutral
296,2/10/2023 2:17,j7ltsd4,"Y’all broke the website, it’s so overloaded",,1,comment,10vnlga,8,2023,neutral
297,2/9/2023 18:56,j7ikgvt,Someone AK’ed all the first years 😳,,64,comment,10vnlga,7,2023,neutral
298,2/9/2023 15:01,j7itv6a,Yea mine said 0 last week,,1,comment,10vnlga,7,2023,neutral
299,2/9/2023 5:18,j7mqwli,Can someone explain the door puzzle? This is why I’m a Hufflepuff,,10,comment,10w00pe,8,2023,neutral
300,2/9/2023 10:36,j7nczlv,"Even more conveniently the triangles are odd and even. Odd starting after the single question mark goes 1,3,5,7,9 and the even with 2 question marks goes 0,2,4,6,8",,1,comment,10w00pe,8,2023,neutral
301,2/9/2023 21:45,j7kalcs,Omg that one took me forever those Damm doors,,8,comment,10w00pe,7,2023,negative
302,2/10/2023 2:07,j7ocqre,It starts at Zero!? Oh ffs,,2,comment,10w00pe,8,2023,neutral
303,2/10/2023 3:13,j7l3khr,inb4 the fan art,,72,comment,10w4g5t,8,2023,neutral
304,2/10/2023 1:23,j7t6bvr,"I suddenly found myself crushing hard. 

That’s never happened to me. 
(Not for a game character)",,1,comment,10w4g5t,9,2023,positive
305,2/10/2023 1:40,j7n6m0u,I saw the red hair and outfit from behind and was in love before she turned around.  After the botany class I was ready to propose,,23,comment,10w4g5t,8,2023,positive
306,2/9/2023 18:04,j7num4u,She's purdy.,,3,comment,10w4g5t,8,2023,positive
307,2/10/2023 3:38,j7inmbm,"Just finished preloading and i’m guilty of trying to press the greyed out play button already lol….. also, it says coming Feb 10 but i assume it’ll still let us play tomorrow for Deluxe edition?",,124,comment,10vnm70,7,2023,positive
308,2/9/2023 18:22,j7jls7j,Pc version **is not** a port.,,1,comment,10vnm70,7,2023,neutral
309,2/11/2023 6:57,j7inu4j,agreed lol was not expecting to see that preload show up lol  im still nervous about the pc issues but also optmistic,,21,comment,10vnm70,7,2023,positive
310,2/10/2023 4:17,j7ihsdi,Indeed.,,4,comment,10vnm70,7,2023,positive
311,2/10/2023 2:35,10wx4md,Hogwarts Legacy is the first game in a while where collecting feels natural and fitting.,240,1654,post,,8,2023,positive
312,2/9/2023 18:06,j7pceqa,This was the greatest thing when I noticed it. Warm fuzzies all over to the devs for NPCs actually sprinting ahead of me when I'm supposed to follow them.,,1,comment,10whp01,8,2023,positive
313,2/10/2023 0:07,j7oybsk,They even speed up if you run into them on the stairs,,2,comment,10whp01,8,2023,neutral
314,2/10/2023 3:08,j7sa3jh,Pretty fuckin standard at this point did you miss the past ten years?,,1,comment,10whp01,9,2023,negative
315,2/10/2023 17:07,j7t6v42,I believe Horizon: Forbidden West does this pretty well too.,,1,comment,10whp01,9,2023,neutral
316,2/10/2023 4:23,j7n9mkd,Yea I can't believe harry potter tine travels back and shoots your character in the throat and leaves. Insane shit but there were hints throughout.,,5,comment,10wbao9,8,2023,negative
317,2/9/2023 18:13,j7n9jnj,"I'm level 20, 10 hours in, just unlocked Broom flying, haven't opened a single lock or tamed a beast.

Reminds me of when asshats went to the midnight releases of Half Blood Prince, got the book early, flipped to the end, and then drove around to the other bookstores that hadn't opened yet and shouted >!Snape Kills Dumbledore!< to the queued up people.",,14,comment,10wbao9,8,2023,neutral
318,2/10/2023 0:24,j7nd9g2,That's slow. Ending videos are usually posted before launch...,,1,comment,10wbao9,8,2023,negative
319,2/10/2023 2:22,j7q94rd,"There's posts and comments all over spoiling the ending. The one I saw said ""TERFS deserve spoilers"". Just avoid all social media about the game, honestly.",,2,comment,10wbao9,9,2023,negative
320,2/10/2023 5:44,j7p734r,"Tbh i think they did an incredible job in the first 2 movies, and some parts of the HL Castle actually remind me of the Chris Columbus movie's castle, they made it too plain from the third onward. 

This is the perfect version tho, when I found the arithmancy class i was in awe.",,2,comment,10wil8l,8,2023,positive
321,2/9/2023 20:57,j7oazmq,Maybe I’m the minority but I never thought the movie locations ever felt like a movie set and were always super immersive,,33,comment,10wil8l,8,2023,negative
322,2/9/2023 22:56,j7py4r2,I agree!,,1,comment,10wil8l,9,2023,positive
323,14/2/2023 16:52,j7po5xk,"I feel like I’ve explored 3 castles yet there is 1/2 I haven’t even seen yet apparently lol. Absolutely incredible work, exceeds expectations utterly",,1,comment,10wil8l,8,2023,positive
324,2/10/2023 22:58,j7muj4t,"After playing Pokémon violet, I hate unopenable doors!",,42,comment,10w9l35,8,2023,negative
325,2/9/2023 11:43,j7plmgk,You mean all doors *can* be opened from your side first? 😮,,2,comment,10w9l35,8,2023,neutral
326,2/10/2023 3:58,j7p8l75,"It's honestly mindblowing. There's no fakery, it's all there and you are rewarded for exploring. It's so immersive, this may be some of the best level design in modern gaming.  


I've been playing without minimap and I've actually quite enjoyed getting lost. It seems so fitting for a fish out of water fifth year. I'm gradually learning my way around but 8 hours in and I'm STILL finding new areas of the castle. It is incredible.",,7,comment,10w9l35,8,2023,positive
327,2/9/2023 11:13,j7ng20e,HONESTLY. I literally found myself lost due to how many doors I went through lol,,7,comment,10w9l35,8,2023,negative
328,2/9/2023 10:04,j7q10rt,"None of the collecting in this game makes any sense in the HP world.  The scrolls are just...dumb...stupid POIs for no reason that you need to find to level up....all the other ""puzzles"" and stuff are just meh...interesting once, then tedious after that...  


I say it makes no sense cause I don't see why in a magical castle, you would have the exact same stuff over and over and over again.  It is just lazy design.  If they had made all these unique, then I may agree with you, but as is, it is no different then any other open world game.",,-11,comment,10wx4md,9,2023,negative
329,2/9/2023 12:48,j7r3yg1,If only Assassin's Creed had a wand for chasing all those stupid flying pages!,,19,comment,10wx4md,9,2023,negative
330,2/9/2023 22:59,j7r4sx9,"I have somehow really enjoyed collecting the pages. However i am already getting slightly bored with the Merlin Trials, way too few variations.",,1,comment,10wx4md,9,2023,negative
331,2/9/2023 13:54,j7r0qye,"I agree so far, it feels pretty natural.  
Only game I've played that felt similar was Ghost of Tsushima as far as collection goes",,1,comment,10wx4md,9,2023,positive
332,2/9/2023 15:46,j7li77x,"Yo, 38 here. Playin' by myself and with the kiddoes. My daughter is particularly excited to get to enroll at Hogwarts. :P",,7,comment,10w81rl,8,2023,positive
333,2/9/2023 17:17,j7m9h1o,"62 here. Downloading game and praying that I'll like it. I'm hoping for something like a Fable/Witcher cross.



I'm hoping for decent progression rewards. I want a decent crafting system. I want something that will absorb me and take me away from real life for a few hours a day


I have cancer. As this life comes to an end maybe I can find a new life just for a few hours each day.


See you in the Hogs Head. I'll be the one propping up the bar


Cheers",,91,comment,10w81rl,8,2023,positive
334,2/9/2023 15:54,j7m1q6i,"24, looking at this thread warms my heart to the very core! hope you all have a splendid time in Hogwarts 🫶",,5,comment,10w81rl,8,2023,positive
335,2/9/2023 18:49,j7lkgej,32 here :),,3,comment,10w81rl,8,2023,neutral
336,2/9/2023 12:13,j3hwlxm,And so it should be,,7,comment,106m5rw,9,2023,positive
337,2/9/2023 14:41,j3hhkqx,"How many post have we seen where people were scared this game would fail? Like it's Harry Potter, that's just an easy way to print money.",,185,comment,106m5rw,9,2023,positive
338,2/9/2023 17:46,j3j11ql,"Remember which other game broke pre-order records?

**Cyberpunk 2077**

Yeah, that was perfectly fine game at launch. Remember, don't pre-order anything. You won't get it any sooner.",,-6,comment,106m5rw,9,2023,positive
339,2/9/2023 17:26,j3kqimg,I understand the hype but I'll never pre-order a game again. I'm waiting for 2 specific reviewers before I make my decision. I'm optimistic but I'd rather wait than risk my money.,,2,comment,106m5rw,9,2023,negative
340,2/10/2023 3:30,j8dj1gt,There is a ridiculous amount of globes in this game. It actually comes of as really f**king lazy to who ever puts these settings together with those props. They should be embarrassed. There literally 3 globes in Figs office alone... 3!!! 🤦‍♂️,,1,comment,10wz72v,2,2023,negative
341,1/9/2023 8:37,j7rswca,I always interact with objects bc it might give achievements,,1,comment,10wz72v,9,2023,neutral
342,1/9/2023 6:08,j7s4osw,Like the Elden ring wall there is gonna be one globe you spin 800 times and a door opens lol,,3,comment,10wz72v,9,2023,neutral
343,1/9/2023 6:13,j7tvm5j,"In the beginning, I flushed every toilet in every bathroom, thinking that something HAD to eventually happen since they were all flushable. Nope. Some people say they still see me lurking around bathrooms late at night, and hear the swirls of flushing water. They would be right.",,3,comment,10wz72v,9,2023,neutral
344,1/9/2023 7:26,10xr3cu,Something I learned playing this game,55,753,post,,9,2023,neutral
345,1/9/2023 5:41,10xav9f,PSA: Don't visit Gaming Circle Jerk if you plan on playing Hogwart's Legacy,112,398,post,,9,2023,negative
346,1/9/2023 11:39,j7t4xkf,Magic can explain everything,,2,comment,10x91zh,9,2023,neutral
347,1/9/2023 6:23,j7u8bgp,nerd.,,2,comment,10x91zh,9,2023,negative
348,1/9/2023 6:20,j7ugovn,Wasn’t discovered and mapped by *muggles* until 1948.,,6,comment,10x91zh,9,2023,neutral
349,1/9/2023 9:43,j7ravxu,How wasn't it discovered/mapped before?,,9,comment,10x91zh,9,2023,neutral
350,1/9/2023 9:55,j7v7kkk,Idk but that rock has seen better days,,5,comment,10xr3cu,10,2023,neutral
351,1/9/2023 6:38,j81iybm,"Its crazy how every town looks like a storybook.

Its great between hearing HIGHWING GO!",,1,comment,10xr3cu,11,2023,positive
352,1/9/2023 9:31,j7vohe9,Off on another adventure are we?,,3,comment,10xr3cu,10,2023,neutral
353,1/9/2023 6:55,j7vh1xd,"Also when leaving Hosmeade, “Hogsmeade, here I come!”😂😂",,12,comment,10xr3cu,10,2023,neutral
354,1/9/2023 5:34,j7zigbo,"When I first met him I had a feeling he was going to be a shit too. Glad I went against my initial impression, I love him. ❤️",,3,comment,10xgnfb,10,2023,positive
355,1/9/2023 6:09,j7t1cql,I won't spoil anything but my opinion of him definitely dropped a few level's at the end of his questline.,,1,comment,10xgnfb,9,2023,negative
356,1/9/2023 10:34,j7tia45,"Yup, as soon as he took the fall in the library I knew I'd do anything for him. Dude is fucking cool, and I don't need any of thw other companions. If I got sebastian, we gunna be alright.",,22,comment,10xgnfb,9,2023,positive
357,1/9/2023 8:39,j7tox06,"I was actually sitting there wondering, if he would throw me under the bus too.. I didn't expect him to, but.. maybe? Now, I know he's my bro - through hell and back!",,10,comment,10xgnfb,9,2023,positive
358,1/9/2023 7:40,j3ja1jf,"They could still be in the game, it could be a set patronus or they might not have every patronus that’s available on wizarding world in the game",,1,comment,106ucxz,9,2023,neutral
359,1/9/2023 6:52,j3juavm,I think the wizarding world site has a pool of like 100-150 possible patronuses. It would be cooler to have the proper sequence of unlocking your patronus be ingame anyway.,,1,comment,106ucxz,9,2023,neutral
360,1/9/2023 7:04,j3isdmn,Yeah it’s a shame!  I sort of hope they haven’t mentioned it because it’s part of a deeper story line. But it’s looking less likely!,,6,comment,106ucxz,9,2023,negative
361,2/9/2023 14:01,j3j4rj4,If I link. Can I change the house?,,3,comment,106ucxz,9,2023,neutral
362,2/9/2023 22:41,j7s2gmm,"It’s functional, but I do wish there were multiple Hogwarts maps just for educational/fun purposes. A map like the Metroid Prime series could help visualize how it’s all put together.

Honestly this is the best it’s ever been. I used to love the older HP games that had you run around Hogwarts. So many hours in Chamber of Secrets, and Order of the Phoenix was mind blowing at the time. But this…. Damn.

I have a “visual map” of Hogwarts in my head much better now, but a Metroid Prime-style map would help the process of getting this place down.",,1,comment,10x5l3a,9,2023,neutral
363,2/10/2023 2:34,j7tt35v,I think they had an interesting idea with the 3d map but it was poorly executed. Not sure if development on it was cut short or what.,,1,comment,10x5l3a,9,2023,negative
364,2/9/2023 8:20,j7sph6a,"Yeah it's a really bad map. There should be a flat, HD 7-layer paper map when you zoom in to max on that screen. Like a Marauder's Map prototype almost.",,5,comment,10x5l3a,9,2023,negative
365,2/9/2023 3:59,j7rjf76,"I mean I like the artwork but I hate the usability. I mean I get that you’re supposed to feel lost and overwhelmed at the start, okay. But do they really expect me to memorize the whole castle to know my way around?? I mean the mini map is great, why don’t make it a full size one? Would help a TON. I want to be able to find my way back to the kitchen or chamber of secrets bathroom without using google or stumbling around for hours… And if I want to get lost I simply turn the map off. Not the best solution right now.",,2,comment,10x5l3a,9,2023,negative
366,2/9/2023 11:30,j7tn9bx,"I went with the standard wand. Wish I didn't lol. 
Rigged looks good",,3,comment,10xlc4d,9,2023,negative
367,2/9/2023 6:02,j7v4zk2,https://preview.redd.it/5jdvl6jtk8ha1.jpeg?width=3809&format=pjpg&auto=webp&v=enabled&s=c086737f0bb284abc2e1d3d01440412fe8de0989,,3,comment,10xlc4d,10,2023,neutral
368,2/9/2023 8:04,j7tnd2c,"&#x200B;

https://preview.redd.it/lrjlkdlk66ha1.png?width=2560&format=png&auto=webp&v=enabled&s=8dfc5891d3b3803b33d675eca40793953a97a080",,10,comment,10xlc4d,9,2023,neutral
369,2/9/2023 18:26,j7ubbqa,https://preview.redd.it/2ng8ufugk7ha1.jpeg?width=4618&format=pjpg&auto=webp&v=enabled&s=03fc82b094d6b1253f1d69e0e53b0bf73d5ba13f,,9,comment,10xlc4d,9,2023,neutral
370,2/9/2023 18:27,j7t9fdk,"On the same note, /r/me_irlgbt/ has a Simpsons meme spoiling the game pinned atm. I delved too deep on the front page 🥲",,1,comment,10xav9f,9,2023,neutral
371,2/9/2023 4:17,j7rck7b,I mean don't visit here either then. Or reddit at all. I've seen people spamming spoilers here too,,0,comment,10xav9f,9,2023,negative
372,2/9/2023 16:52,j7rcdu9,Can confirm: that sub is full of self righteous assholes. I'd avoid it at all costs.,,26,comment,10xav9f,9,2023,negative
373,2/9/2023 15:00,j7re0uj,Alternative title:  Don't visit Gaming Circle Jerk.,,8,comment,10xav9f,9,2023,negative
374,2/9/2023 11:10,j7wkx0t,"  It's neat to explore the less known ones. I love the slytherin common room. It also adds to immersion, for me at least. Is there something you dislike about them? 

  To me it just shows how fleshed out the castle is. There may be more quests given to you there, I'm not too far into the main story just yet.",,2,comment,10xtwc9,10,2023,negative
375,2/9/2023 4:19,j7wti92,"Hopefully as time goes on they will add animations like sitting and sleeping, it adds immersion",,2,comment,10xtwc9,10,2023,neutral
376,2/10/2023 20:35,j7voted, weird how a simple feature like sleeping or classmates going to bed is not implemented  in an open world game where almost every game with a bed would make the bed as a quick save point or some kind of feature. I don’t believe it would be that difficult and costly to implement a simple feature like sleep or see classmates moving in the common room or sleeping at night,,11,comment,10xtwc9,10,2023,negative
377,2/9/2023 12:58,j7w8odh,"I think this could've been improved on by taking some features from other games (which honestly they do a lot already as interface wise I get massive Assassin's Creed vibes). 

Red Red Redemption camp is a good model. Even if we could've played chess or something with NPCs. 

Manual saving could've been tied to the bed. And maybe you could customize your bed area. 

However what they lacked in the common room they made up for with the room of requirement customizations, something I wasn't expecting and was totally blown away by.",,8,comment,10xtwc9,10,2023,neutral
378,2/9/2023 8:50,107l9kc,"""What will you summon?""",105,261,post,,10,2023,neutral
379,2/9/2023 6:11,10y38zj,Cannot state the importance enough: Be very certain about what talents you want.,255,277,post,,10,2023,neutral
380,2/9/2023 10:36,j7yueb0,"But also empty of people, interactions, and routines.",,7,comment,10yexzt,10,2023,negative
381,2/10/2023 1:19,j7z583y,"Not all accessible. You can't freely jump/climb on things, or jump off railings, like to see what's at the bottom of the Grand Staircase. I can see a floor down there but that's it.",,-5,comment,10yexzt,10,2023,neutral
