,created,id,content,num_comments,score,type,post_affiliation,month,year,sentiment
382,2/9/2023 19:28,j816yxm,"My only disappointment with the map is Forbidden Forest, the area around the Quidditch field is too closterphobic with that giant mountain...makes it feel smaller than the movies/book made it feel, and the entire second region of the map to the southeast is behind a little chokepoint. 

It'd be one thing if it was locked but as far as I can tell (granted I didn't look till chapter 3) you can just sneak passed the goblins or run and access it. 

So why we can't just fly over is beyond me and the inability to fly contiguously over the whole map kinda blows...having that chokepoint just forces me to teleport to access the other area.

They have an RPG leveling system ..use it to region lock...idk why you need this choke points that undermines the fluidity of the map once you get passed it and are the right level. 

I wanted an immersion run with little fast travel but this game feels antithetically opposed to that concept. 

Hopefully the second game has more creative ways to lock off areas. 

My biggest wtf is still Forbidden Forest. 

It's so tiny, filled with nothing but filler to the brim which makes it feel unmysterious and conquered....in the books and movies it looked wild and limitless. They should have had it go to the map border and continue onward blocked by powerful enemies. 

Also they shouldn't have let us fly over it....destroys the entire element of it being imposing if I can just fly right to my objective and ignore the whole layout.


The rest of the map is a real treat and I just wish they used it for more than just puzzles. Not a single fight can break out or anything interesting beyond npc chatter.",,1,comment,10yexzt,11,2023,negative
383,2/9/2023 21:36,j816jep,"Initially I thought it was too small and missing a bunch of shit but when you unlock Alohamora you get access to the rest. Some areas are still not built out as far as ""there is a building there but nothing there internally""...but as it stands like maybe 10% of the castle even used and maybe 1% of it you use more than once for the puzzle or quest and then never go back.",,-1,comment,10yexzt,11,2023,positive
384,2/9/2023 17:02,j7w5u6l,...Oh my merlin.  I'm never going to complete the main questline at this rate.,,37,comment,10y2u7v,10,2023,negative
385,2/9/2023 15:16,j7ywsue,Ah thats why that one whas pink. To bad I freed him haha,,1,comment,10y2u7v,10,2023,neutral
386,2/9/2023 16:37,j7w7dnt,"Just what I needed, another reason to not be able to take a break from this game.",,27,comment,10y2u7v,10,2023,positive
387,2/9/2023 12:42,j7xb0nk,Got a shiny pufeskin while learning how to catch beasts!,,3,comment,10y2u7v,10,2023,neutral
388,2/9/2023 19:46,j7vvky1,Can you PLEASE post a video of it ❤️❤️❤️,,4,comment,10y464p,10,2023,neutral
389,2/10/2023 1:07,j80wyww,"Chopin is fine, sure. But that frog choir is sick!",,2,comment,10y464p,11,2023,neutral
390,2/10/2023 2:41,j7ybr7l,Bach’s Fugue in G minor keeps the music room humming,,1,comment,10y464p,10,2023,neutral
391,2/9/2023 15:37,j7z8rpk,Luigi Boccherini Minuetto is dope!,,1,comment,10y464p,10,2023,neutral
392,2/9/2023 23:38,j3novpt,Id summon February 7th if i wasn’t such a muggle,,31,comment,107l9kc,10,2023,neutral
393,2/9/2023 20:11,j3qz0ml,"Is no one gonna reference the oney catroons clip?  
[Ahh, Accio bum! Ron staaahp!](https://youtu.be/reop2bXiNgk)",,1,comment,107l9kc,10,2023,neutral
394,2/9/2023 17:04,j3n8vug,Looks like the >!Restricted section gated off!< in the library snip 😈,,27,comment,107l9kc,10,2023,neutral
395,2/9/2023 13:31,j3n7wh4,"Maybe it's just the lighting, but it looks like spells will have a different appearance depending on how you use it. In all of the clips, Accio looked different getting noticeably shinier + more glossy towards the end when cast on a human",,10,comment,107l9kc,10,2023,neutral
396,2/10/2023 5:03,j7yx9o7,"(Anytime I Floo travel anywhere especially Hogsmeade).

 *""wHaT ArE yOu uP tO nOw? wHaT ArE yOu uP tO nOw? wHaT ArE yOu uP tO nOw?""*",,656,comment,10yq24z,10,2023,neutral
397,2/9/2023 20:54,j826q5g,"""By Merlin's great ballbag""",,4,comment,10yq24z,11,2023,neutral
398,2/9/2023 19:13,j7z3fjr,"""Your health is low! do you have any potions, or food?""  


Anyone who played Fable knows how annoying a single phrase can get.",,170,comment,10yq24z,10,2023,negative
399,2/9/2023 21:43,j7ywqgj,"Hogsmeade, here I come... 28 here",,30,comment,10yq24z,10,2023,neutral
400,2/9/2023 15:01,j7yd4qb,"Yes there should be a toggle of having social tab as your choice for appearance. and then you edit that social tab and it stays on always even if you change the actual armor/gear.

Anarchy Online had the social tab perfectly implemented. It'd be perfect in this game as well.",,1,comment,10y6o6c,10,2023,neutral
401,2/9/2023 21:04,j813l91,I don't mind it too much. It gives me the chance to see the new gear. I've changed my guys look a few time cause of some new items. Plus it's not too inconvenient to change it back. Takes me a second. I do like the idea of having a setting to lock in that appearance.,,1,comment,10y6o6c,11,2023,positive
402,2/9/2023 6:02,j7ywl2w,"Noooooo! Don't do that. This is the same crappy system that cyber punk has in place and it completely breaks immersion. Some gear is better than other gear, and your style is at odds with this. Just like reality.",,-2,comment,10y6o6c,10,2023,negative
403,2/9/2023 16:47,j81vccl,I agree that we should be able to save outfits.  But I believe you can already change the gear look in the menu.,,1,comment,10y6o6c,11,2023,positive
404,2/9/2023 14:10,j7yx69v,"omg, I didn't realise they had a bug report page! guess it should be obvious lol but thanks for sharing!! voted :)",,55,comment,10ynwin,10,2023,positive
405,2/9/2023 11:35,j805jmd,"I saw an article in my feed indicating there would be an optimization patch, dunno if it's true or not as I have not been clicking article links to do with the game as it's almost entirely clickbait.",,1,comment,10ynwin,11,2023,neutral
406,2/9/2023 7:32,j7zmu1n,"I like most people have been getting the frame drops. I turned down the character population setting to low. I couldn't notice much of a visual difference but my fps increased a lot. 
  
I'm running on a 3080 with a 9600k. I was curious so i tried putting the game to the lowest settings and the game went to like 15 fps lol. Idk whats going on here.",,11,comment,10ynwin,10,2023,negative
407,2/9/2023 5:16,j7znq6s,"I saw someone else post this and it helped my game a lot. 

&#x200B;

Turn Camera Sensitivity to 2 (Max) and Camera Acceleration to 0. Hope this helps people enjoy a smoother experience.",,3,comment,10ynwin,10,2023,neutral
408,2/9/2023 6:23,j7xtouj,"I love it. It shows ambition doesn’t equate evil. 

Like Sebastian is such a great example that at surface he just seems ambitious but then explains how it’s all about his dying sister. 

I’ve really enjoyed the cross house communications",,200,comment,10yb7ic,10,2023,positive
409,2/9/2023 5:28,j7z2qmc,I like Ominis I just wish they made Salazar Slytherin more nuanced,,2,comment,10yb7ic,10,2023,negative
410,2/9/2023 11:05,j7xrln2,When I heard a Hufflepuff bashing on muggles 😌,,174,comment,10yb7ic,10,2023,neutral
411,2/9/2023 5:17,j7xc58f,"Slytherine wasn't an Evil house traditionally. The founder was a purist who liked clever, ambitious students. The slytherine you're thinking of was after Tom Riddle basically turned it into his cult.",,87,comment,10yb7ic,10,2023,neutral
412,2/9/2023 12:44,j7vr2ux,I upgraded Incendio then 2secs later learned Confringo which is much better... now I'm scared of spending my points wrong lol,,133,comment,10y38zj,10,2023,neutral
413,2/9/2023 13:19,j8a6o3h,"Just gonna add that Spells, Dark Arts and Core talents add up to 36.. which is how many presents Dudley got in Sorcerer's Stone.",,1,comment,10y38zj,2,2023,neutral
414,2/9/2023 5:27,j7vyzqk,I think there was a post yesterday that said it could be coming in the future. They found the hidden game files or something?,,30,comment,10y38zj,10,2023,neutral
415,2/9/2023 5:26,j7yxd7l,"They really need to add it. Someone found a potion in the game code, I'll be needing that please Avalanche.",,3,comment,10y38zj,10,2023,neutral
416,2/9/2023 20:56,10zmr2a,I think I might be a potion master,113,730,post,,11,2023,neutral
417,2/9/2023 8:07,j83irt0,I hope it wins,,3,comment,10z6i6w,11,2023,positive
418,2/9/2023 5:37,j8253av,"Love that none of the harassers have acknowledged how well the game handles the issues their harassing about.  But not surprised by the blind, ignorant rants",,338,comment,10z6i6w,11,2023,positive
419,2/9/2023 5:37,j831i19,Tears of the kingdom is going to take GOTY or Spider-Man 2 probably.,,4,comment,10z6i6w,11,2023,neutral
420,2/9/2023 5:47,j82wnfl,Game is definitely GOTY material; it can’t be ignored. I see ppl try to say the game is mid without playing it and saying positive reviews are forced. But actually playing the game and that’s obviously not true. I guess ppl need to say those things to cope that they won’t play a quite frankly amazing game. I wonder how many are quietly playing it anyway without saying it?,,11,comment,10z6i6w,11,2023,positive
421,2/9/2023 22:56,j83cgzq,Hm. Seems a pleasant enough little place.,,2,comment,10yxrg1,11,2023,neutral
422,2/10/2023 2:46,j82i5lv,"Brooms, apparition, portkeys... Still faster than horses and carriages 🤣",,1,comment,10yxrg1,11,2023,neutral
423,2/10/2023 5:28,j806evz,"Yes, because I've never used floo powder without the game forcing my hand.",,47,comment,10yxrg1,11,2023,neutral
424,2/10/2023 6:29,j807hk2,"Also, all roads seem to lead to Hogsmeade.",,213,comment,10yxrg1,11,2023,neutral
425,2/10/2023 1:19,j81wyk9,my only gripe is the main story kind of sucks and doesnt have a lot of payoff,,1,comment,10ywbmy,11,2023,negative
426,2/9/2023 23:15,j828e9d,"I’m anticipating Hogwarts Legacy, Armored Core 6, Zelda, Starfield and maybe Stalker to be in the running for GOTY.

Could be some other surprises in there like Redfall (previous GOTY nominee studio), Metroid Prime (remaster / Nintendo hype factory), Jedi Survivor, maybe some random indie games.",,4,comment,10ywbmy,11,2023,neutral
427,2/10/2023 0:54,j81kw9b,No shot this game gets the fair chance it deserves. Game awards always prioritize identity politics more than actual game quality,,-1,comment,10ywbmy,11,2023,positive
428,2/9/2023 20:50,j81lqvd,"I’m about 36 hours in. I haven’t been this impressed in a game since…. I don’t remember. I just played through Legends Arceus right before HL, and that game was great too. Overall it’s been a great 2023 for video games for me (I did Legends Arceus late).

I have no idea what game could possibly knock Hogwarts Legacy from the spot. I can’t think of any other games this year that I think will be better. I mean, you know, CoD or Fifa or whatever always do well but those don’t usually win awards right? 

I am just so blown away by the detail and clear love for the franchise this game has. Imagining a sequel (hopefully in another country and another school, eventually loop back to Hogwarts after a few games) expanding the world building and improving on the mechanics when this game is already so amazing… it blowsmy mind.

I feel like a little kid raving about the new toy. I’m in my 30s. Been such a long time since I played a game that was *this* good. Maybe Horizon Zero Dawn or Breath of the Wild?

Edit: Should have read more, Tears of the Kingdom and Spider-Man 2. But even then, those are sequels so probably won’t be as new, novel, and mind blowing, although they would be strong contenders for GOTY.",,0,comment,10ywbmy,11,2023,positive
429,2/10/2023 7:27,j3x3wh0,"![gif](giphy|l4FGGafcOHmrlQxG0|downsized)

I've always envisioned Phineas Nigellus Black as being an extremely competent and intelligent wizard, while being absolute shite at teaching kids. Hope he won't just be a Lockhart-like buffoon.",,5,comment,1095tnb,12,2023,negative
430,2/10/2023 7:43,j3wiyno,Just when i thought they couldn't catch out off guard like this again haha wow! What a fucking surprise 🔥,,2,comment,1095tnb,11,2023,positive
431,2/10/2023 4:13,j3wa4p4,"Isn't he the guy who ranted about the Tories and maths like a week ago? Loving him already. 

Seriously, someone needs to give that Casting Director a trophy, a fucking huge one. Fucking great job so far in all regards.",,48,comment,1095tnb,11,2023,positive
432,2/10/2023 5:47,j3w8q3l,"Lol normally actors stretch as far as it takes to sympathize with their characters but Simon Pegg is just like ""no this guy sucks haha.""",,195,comment,1095tnb,11,2023,positive
433,2/10/2023 0:49,j84h9nv,I just unlocked the room.. at level 22. Am I the only one that just stopped playing the main quests for way too long?,,9,comment,10zmr2a,11,2023,neutral
434,2/10/2023 3:10,j85wrhb,Did Playstation only get the recipe for felix potion or are they the only ones allowed to make it ? If we know the ingredients can we Make it on Xbox and pc ?,,2,comment,10zmr2a,12,2023,neutral
435,2/9/2023 21:24,j83waml,I found it funny when he first said that when I unlocked the room but hadn’t even made my first potion,,19,comment,10zmr2a,11,2023,positive
436,2/10/2023 8:13,j83vxni,I decided early on the only potions i care about making are wiggenweld and thunderbrew. I have 7 T-shape potion tables constantly making me just those 2 potions.,,121,comment,10zmr2a,11,2023,neutral
437,2/9/2023 20:48,j3sx2rt,Slytherin here I come! 🐍,,3,comment,108gdih,11,2023,positive
438,2/9/2023 21:39,j3snp6j,HUFFLEPUUUUFFFFF!!!! I choose you!!!,,137,comment,108gdih,11,2023,positive
439,2/10/2023 5:10,j3swdcn,"My reply to it.

https://preview.redd.it/c66c0w96pbba1.png?width=1440&format=pjpg&auto=webp&v=enabled&s=587e5ba87b9d5945906233954472fee4ef89d4b5",,-7,comment,108gdih,11,2023,neutral
440,2/10/2023 8:20,j3ss9dy,"Does this mean there'll be a sorting ceremony? I remember there's a tab in the character creation where you can choose your house, but it would be neat to sit through the ceremony too :)",,9,comment,108gdih,11,2023,neutral
441,2/10/2023 11:23,j85ge5m,Does anyone know who voices Sebastian? I need to know who voices my first video game crush,,4,comment,10zb8hc,12,2023,neutral
442,2/10/2023 2:57,j865jm4,I know romance options were a controversial topic but honestly I feel like Sebastian’s story with the MC could have made a cute little 15 year old love story. Who’s going to crucio who?? 🥺👉👈,,25,comment,10zb8hc,12,2023,positive
443,2/10/2023 3:46,j8a2dp6,"Agree here. I didnt like main charecters story at all, boring, but when we got a lil deeper into sebastian's i was all in!",,2,comment,10zb8hc,2,2023,negative
444,1/10/2023 2:07,j86b1p9,"Does anyone know when I’ll get the quest for Imperio? I only have like 8 or 9 main quests left and I’m getting stressed, haha. Just did in Shadow of the Mine.. how do I unlock the rest?",,2,comment,10zb8hc,12,2023,neutral
445,2/10/2023 19:51,j42kwgk,I've always wanted a Harry Potter mmorpg,,3,comment,108nwp7,1,2023,positive
446,2/10/2023 5:24,j3tnwjz,"“Mods will take care of that 😎”

-someone who doesn’t know what they’re talking about lol",,70,comment,108nwp7,11,2023,negative
447,2/10/2023 18:08,j3tgmr4,Idc about that i just want to know if i can play with my friends.,,6,comment,108nwp7,11,2023,neutral
448,2/10/2023 8:28,j3xbosx,"Personally happy the team chose to make it as a single player focused game, not pvp or mmo additions, so tired of those being forced into games",,2,comment,108nwp7,12,2023,positive
449,2/10/2023 3:11,10zvhgl,Anyone else wish you could look down while on a broom and not descend?,107,879,post,,12,2023,neutral
450,2/10/2023 11:39,10zzjre,Does it get any more cozy than Hogsmeade?,39,440,post,,12,2023,neutral
451,2/10/2023 23:19,j87jqmi,Couldn't agree more! the high top curly/fro fade was what i went with!,,3,comment,1102df3,12,2023,positive
452,2/10/2023 19:45,j8953ps,"Yeah, I was really happy seeing that I could create a proper black character not just a white guy with black skin. XD Though many games CC has gotten better over the years, I feel that Hogwarts' Legacy stands out with options for black people.",,3,comment,1102df3,2,2023,positive
453,2/11/2023 1:48,j88pznp,"This game has dogshit customization. Yes, it has some good black hairstyles, but that's it. You have no granular detail over any facial features at all.",,17,comment,1102df3,12,2023,negative
454,2/10/2023 19:26,j88j5jg,Ironically the worst white customization lol,,20,comment,1102df3,12,2023,negative
455,2/10/2023 16:05,j87t1m7,Among other things...,,1,comment,10zvhgl,12,2023,neutral
456,2/10/2023 23:04,j89to2i,If they just put pitch and roll on the left stick and the camera on the right it would be much better,,1,comment,10zvhgl,2,2023,negative
457,2/10/2023 20:06,j85h48w,Completely agree.,,2,comment,10zvhgl,12,2023,negative
458,2/10/2023 21:29,j86xuqe,Yes. Yes. Yes. It's so annoying.,,2,comment,10zvhgl,12,2023,negative
459,2/10/2023 21:17,j86v9kn,This games atmosphere and visuals rival ghost of Tsushima for me. So good,,3,comment,10zruae,12,2023,positive
460,2/10/2023 22:08,j89zutl,Honestly I respectfully disagree. It is definitely nice as many people would see but for me it makes the game a little faded and hard to see. I had to tweak the upscale sharpness and graphic settings when the season changed. I guess I’m just more biased for a cooler setting. Also @devs please add a season changer ;),,1,comment,10zruae,2,2023,positive
461,2/10/2023 19:07,j870jib,"Oh yeah Autumn OR falls, little misunderstanding.",,2,comment,10zruae,12,2023,neutral
462,2/10/2023 18:31,j858q50,The great hall looks amazing in fall.,,11,comment,10zruae,12,2023,positive
463,2/11/2023 10:38,j8b75fx,"yeah I was really overleveled when I get talents too. I just hit 34 and am now on the Sebastian quest in Feldcroft. Unlocked Beasts two levels ago... I just kept wanting to explore and clear the POIs (and merlin trials for inventory space), and track down as many collectibles in Hogwarts/Hogsmeade as I could (still missing like 20 field pages in Hogwarts even tho it feels like I've exhausted my search...). But it's nice having access to most of the spells! It does make the main quest pacing feel weird but that happens with me in open world games a lot so it's more of a thing I'm used to.",,1,comment,110gkow,2,2023,positive
464,2/11/2023 5:34,j8bqr3e,"I’m 6 hours in and only about to go to potions class. I’ve barely had any combat. I’m surprised I’m playing it this long still, but it really is good.",,1,comment,110gkow,2,2023,positive
465,2/10/2023 11:43,j8b2emp,"I was about level 16 when I unlocked talents. 

But I've slowed way down since then so I sit at 45 hours, I'm level 29 now and I still haven't done the second trial I've been collecting beasts, shitting on bad guys and tackling the puzzles and challenges. Side quests have been pretty fun so far, a few that were simple fetch quests but the little stories and lore you get from those quests can be worth it too if you're a fan of Harry Potter in general. 

It's been a blast to say the least.",,4,comment,110gkow,2,2023,neutral
466,2/10/2023 19:31,j8akazi,"Pretty much exactly where I’m at, I think I’m level 19-20 and I just got my broom last night and unlocked talents. Been playing since Tuesday too lol. I can’t stop mindlessly wandering everywhere for pages and getting lost lmao",,3,comment,110gkow,2,2023,positive
467,2/11/2023 0:16,j89i0fz,I wish we could’ve casted spells like revelio and lumos by swiping the touchpad,,1,comment,10zzw01,2,2023,neutral
468,2/11/2023 6:11,j872rpa,"Besides the point, but I love how the lighting changes when you cast lumos. Creates such an amazing atmosphere",,31,comment,10zzw01,12,2023,positive
469,2/11/2023 5:31,j87x0bn,"Same for Reparo and stealth. At least you don't have to slot Wingardium Leviosa, an Accio picks up the item too.",,1,comment,10zzw01,12,2023,neutral
470,2/10/2023 13:12,j88g7mc,"Also Repairo. It should be a context prompt. It's barely used anyway and just annoying when you have to swap it in temporarily.

In fact all the blue spells should've been non slotted.

Lumos by holding revelio

Repairo context sensitive

Wingardium Leviosa can already be activated by holding Accio

Disillusionment could be a thumbstick button.",,6,comment,10zzw01,12,2023,negative
471,2/10/2023 10:12,j87vkom,Fuck ruzzia,,-1,comment,10zr7x3,12,2023,negative
472,2/10/2023 12:30,j87lqnm,"It's because of the new law on ""gay propaganda"". Lots of stupidity happening because of it now",,1,comment,10zr7x3,12,2023,negative
473,2/10/2023 15:30,j85ibuv,What do they do with Sirona?,,5,comment,10zr7x3,12,2023,neutral
474,2/10/2023 4:53,j84mc99,"This is normal, I think.",,7,comment,10zr7x3,12,2023,neutral
475,2/10/2023 9:44,j861xtz,[deleted],,-10,comment,10zzjre,12,2023,neutral
476,2/10/2023 8:28,j8a7w5t,Winds howling....,,1,comment,10zzjre,2,2023,neutral
477,2/10/2023 3:15,j87gxg0,All roads seem lead to hogsmeade.,,6,comment,10zzjre,12,2023,neutral
478,2/10/2023 19:27,j87fvnf,All roads seem to lead to Hogsmeade,,7,comment,10zzjre,12,2023,neutral
479,2/10/2023 19:54,j8959ze,Well I'm judging them for not finding the barely hidden chests full of gold and relics that have just been sitting there for centuries. Every other generation of Hogwarts students is an embarrassment.,,3,comment,10zvm0c,2,2023,negative
480,2/10/2023 6:34,j86naib,"Not to mention, I've knackered that dinosaur skeleton a dozen times now.",,1,comment,10zvm0c,12,2023,neutral
481,2/10/2023 18:22,j86nxf8,My favorite part is walking into Random peoples houses and just opening their chest and taking a free scarf I'm just going to sell shortly thereafter,,18,comment,10zvm0c,12,2023,positive
482,2/10/2023 7:19,j85ytzm,they just jealous of my merlin drip,,10,comment,10zvm0c,12,2023,neutral
