,created,id,content,num_comments,score,type,post_affiliation,month,year,sentiment
0,2/7/2023 4:39,i2zvnvq,"If you didn't tell me, I'd believe this is what we are to be expecting in the game. Looks excellent!",,1,comment,ttkyky,1,2022,positive
1,2/7/2023 5:10,i2zg0k6,"I wasn't expecting this to be good. Remember in the 1 year drought, where ever other day someone made a ""intro screen concept"" that was just the official wallpaper with text on top?


This is GREAT. I am so hyped",,3,comment,ttkyky,1,2022,positive
2,2/8/2023 4:22,i2ytpmr,"That's a real shame. The Grey Wizard let us all down. As I said on the stolen post, this is clean af. Well done.",,6,comment,ttkyky,1,2022,negative
3,2/7/2023 8:49,i317mih,"Ohh man, sorry for that, nobody should steal other person's work, it's just a shame. Thanks for reaching to us with the truth, so we can not support whoever does that.
All in all your work is amazing, thanks for sharing this to the world, as I believe it inspires others in the best way.",,2,comment,ttkyky,2,2022,positive
4,2/7/2023 23:09,10f9rn9,Our playable character has a connection to London,127,498,post,,1,2023,neutral
5,1/7/2023 5:48,10pr9zy,Ron's Goblet of Fire dress robes in game?,41,364,post,,1,2023,neutral
6,1/7/2023 19:30,j4b2fvc,"The original Harry Potter game was a huge part of my childhood. It might be dated by today's standards, but I have so many fond memories of exploring Hogwarts as a kid. The soundtrack also did such a fantastic job of creating that feeling of wonder and mystery. The part from 0:30 honestly made me tear up a little because all those memories came flooding back.",,36,comment,10bllqy,1,2023,positive
7,1/7/2023 5:12,j4bnscm,"It would be such a missed chance if they don’t reference this tune in HL, it’s such a key part of the games and it would be cool as this is gonna be their direct successor",,5,comment,10bllqy,1,2023,negative
8,1/7/2023 9:30,j4blah0,I can sleep to the chamber of secrets sound track,,7,comment,10bllqy,1,2023,neutral
9,1/7/2023 6:36,j4dlgxo,Took time off just to play this non stop!,,2,comment,10bllqy,1,2023,positive
10,1/8/2023 2:47,j5r5d8g,Let me take some gillyweed or use a bubblehead charm to explore the black lake!,,1,comment,10k8ak1,1,2023,neutral
11,1/7/2023 8:46,j5pjljq,"Why do you all care so much about swimming? Seriously, genuinely curious.

Edit: I truly never thought about a swimming mechanic as 100% of the RPGs I’ve played, has swimming…But hey, here’s to swimming 🥂",,2,comment,10k8ak1,1,2023,neutral
12,1/7/2023 7:15,j5rzo21,The swimming situation is getting just as annoying as the jump button situation,,2,comment,10k8ak1,1,2023,negative
13,1/7/2023 8:34,j5revii,Why do y'all want swimming so bad?  Swimming is the worst part in every video game.,,-1,comment,10k8ak1,1,2023,negative
14,1/10/2023 5:07,j4vko2b,"I'm surprised they'd even show the muggle world, even it it's only for a trailer.",,119,comment,10f9rn9,1,2023,negative
15,1/7/2023 5:53,j4wmsjw,"As a Londoner, this was very nice.",,3,comment,10f9rn9,1,2023,positive
16,1/8/2023 1:12,j5083qd,BRI'ISH?!,,3,comment,10f9rn9,1,2023,neutral
17,1/7/2023 21:24,j4zp28t,The character does have a British accent so we've always expected England. London is not the only place in England so maybe the character was just visiting or maybe they live there.,,1,comment,10f9rn9,1,2023,neutral
18,1/7/2023 19:45,j495xcp,Dragons fully confirmed in the game in a immersive way not just in a mission. This game keeps exceeding my expectations & I love it!,,5,comment,10b765k,1,2023,positive
19,1/7/2023 7:07,j490krx,Falling from your broom will be interesting,,28,comment,10b765k,1,2023,neutral
20,1/7/2023 10:28,j4971fb,i wonder if we can fight dragons like GOW.,,12,comment,10b765k,1,2023,neutral
21,1/7/2023 7:39,j48pvkq,"Woah, she's been recording (prob off and on) for 3 years? There must be a ton of player dialogue in this game",,271,comment,10b765k,1,2023,positive
22,1/7/2023 5:13,j5u7vea,"~~I wonder if the second red spell is Sectumsempra or just a cutting curse.  It logically shouldn't be Sectumsempra because Snape invented it, but I can hold out hope...~~ It's just a cutting curse.",,10,comment,10l22om,1,2023,neutral
23,1/7/2023 10:36,j5u9nsp,I feel like they should have added more.,,7,comment,10l22om,1,2023,negative
24,1/7/2023 10:51,j5usvg7,What the one that looks like wombat poop?,,2,comment,10l22om,1,2023,neutral
25,2/7/2023 20:19,j5xb8ov,I want sectum sempra. Sadly this wasn’t invented at the time of this game. Headmaster Severus Gruber came later.,,1,comment,10l22om,1,2023,neutral
26,2/7/2023 17:18,j60fb4s,"I mean, it'd be weird if you could just up and use whatever wand you felt like using at the time. The wand chooses the wizard. Wizarding World/Pottermore told me I was chosen by a 12 1/2"" Cypress wand with a Dragon Heartstring core and slightly yielding flexibility. Thats what I got so thats what I'm committed to",,6,comment,10ly87p,1,2023,neutral
27,2/7/2023 20:10,j61sqye,"welp, it's not light saber. So, expected not to switch once your wand has chosen you. 

&#x200B;

I do hope they look really good in game though haha. I would hate if my wand looked simple af like a wand from those filler movie students that show up once or twice.",,5,comment,10ly87p,1,2023,neutral
28,2/7/2023 21:33,j60h17w,"Shame, was kinda hoping we'd be able to at least equip silencers on the wands or add a thermal scope.",,24,comment,10ly87p,1,2023,negative
29,2/7/2023 8:59,j62u52g,Fine with that. The only thing I thought may play a factor here was defeating a witch or wizard and taking their wand.,,2,comment,10ly87p,1,2023,neutral
30,2/7/2023 12:05,j4qbh54,"i hope your stats isn't only hp, defense and offense.",,2,comment,10dv5u7,1,2023,neutral
31,2/7/2023 9:11,j4pfkdv,I didn't know I was going to play Assassin's Creed Hexe next month!,,9,comment,10dv5u7,1,2023,neutral
32,2/7/2023 11:25,j4o7bre,It’s awesome!!! I wonder if part of the flying missions is to help your quidditch team. So maybe there aren’t any quidditch games but maybe just going after the snitch in practice,,22,comment,10dv5u7,1,2023,positive
33,2/8/2023 2:24,j4pod4x,Looks like AC Valhalla,,1,comment,10dv5u7,1,2023,neutral
34,2/8/2023 3:02,j6peyd6,Still unfashionable even in the 1890’s haha.,,2,comment,10pr9zy,1,2023,negative
35,2/8/2023 0:56,j6mxtbe,"And let it be the high tier ones with a description 

(this magnificent robe is the most fashionable robe of this century and will certainly withstand the test of time going forward into the 1900, it's just a fashionable timeless piece) 

and let it be handed down by headmistress Wealey.",,9,comment,10pr9zy,1,2023,neutral
36,2/7/2023 23:09,j6m511o,"This would be awesome, also when you wear NPC's should comment on how fashionable the robe is haha",,95,comment,10pr9zy,1,2023,neutral
37,2/7/2023 14:24,j6r329k,"I know it's totally out of character for Ron, but I wish he'd responded with, ""That's right, Malfoy. Figure I'd give the rest of you a fighting chance in getting dates.""",,2,comment,10pr9zy,1,2023,neutral
38,2/7/2023 19:03,j6hi4r5,"It is not your ability, but the choices you make",,3,comment,10oy8xv,1,2023,neutral
39,2/7/2023 9:19,j6hhcor,This looks amazing! Is it official art?,,9,comment,10oy8xv,1,2023,positive
40,2/8/2023 6:01,j6hlwo9,Lol professor Fig was the Ravenclaw companion all along,,54,comment,10oy8xv,1,2023,neutral
41,2/7/2023 22:33,j6hri1u,"I can’t believe we finally get a game where we can play as Hagrid, Ron, Percy, Harry, Snape, Gandalf, Kal-el *and* Harmony Korine. Kids was such as awesome movie!",,1,comment,10oy8xv,1,2023,positive
42,2/7/2023 21:34,j6bao32,"I can't wait to play all 4 houses to see what each room looks like. I'm gonna be enjoying the nice underwater view the Slytherin room has first, though.",,2,comment,10nki44,1,2023,positive
43,2/7/2023 10:36,j69unwm,I will be joining Ravenclaw.  It’s just THE BEST common room.,,50,comment,10nki44,1,2023,positive
44,2/7/2023 10:32,j6987w3,Just another reason to join Ravenclaw!,,124,comment,10nki44,1,2023,positive
45,2/8/2023 5:04,j6a4dv4,And here I am enjoyed what in my opinion is the best common room: mine. GRYFFINDOR !!!,,1,comment,10nki44,1,2023,positive
46,2/8/2023 2:53,j6k2gof,"Yea,. Took Thurs/Friday off.  4 day gaming weekend coming up.",,13,comment,10pakt4,1,2023,positive
47,2/8/2023 5:02,j6m0es4,"Hell yes.

8th to 20th - gonna be so good.",,3,comment,10pakt4,1,2023,positive
48,2/8/2023 6:14,j6kwhnf,Took Wednesday off and work from home. Didn’t tell a soul so they assume I’m working and leave me be for the day.,,3,comment,10pakt4,1,2023,neutral
49,2/8/2023 6:35,j6np4aj,Good thing that I do not have an actual job.,,2,comment,10pakt4,1,2023,positive
50,2/8/2023 3:59,j65tj6i,"![gif](giphy|W6pGEOMBtEW178JApa)

Everybody has their own opinion and its fine. I was being sarcastic because I actually love how talkative they are and I saw a lot of in game scenes. We cant expect this game to be like any Rockstar game. Sorry if anybody felt attacked",,10,comment,10mwhej,1,2023,neutral
51,2/7/2023 23:13,j678763,They are mad NPCs are legit copied and pasted everywhere and are identical twins standing right next to each other. Don't be dumb,,10,comment,10mwhej,1,2023,negative
52,2/8/2023 10:05,j65xyik,Is that a Pippi Longstockings reference with the one walking up and down the wall?,,6,comment,10mwhej,1,2023,neutral
53,2/8/2023 9:08,j65tuau,Lmao great video dude,,-1,comment,10mwhej,1,2023,positive
54,2/8/2023 9:13,x3dwc3,New Images of Ravenclaw Common Room,50,287,post,,2,2022,neutral
55,2/8/2023 10:33,imr7puc,This one isn’t as good as the others,,1,comment,x3dwc3,2,2022,negative
56,2/8/2023 8:15,imt83kb,"this may be just a weird pointless connection that my brain alone made, but do the graphics of this game look exactly like Assassins Creed Black Flag to anyone else? like something about this feels exactly like the player home you get in Nassau or something",,1,comment,x3dwc3,2,2022,negative
57,2/7/2023 20:16,imp5y71,"Very happy they included creativity and didnt go for the same old boring ""clever and intelligent only books library vibe"" the common room looks amazing.",,14,comment,x3dwc3,2,2022,positive
58,2/8/2023 4:03,imowmxe,"If anything, the game will have an amazing Hogwarts to explore. Literally can't wait to roam around the castle.",,42,comment,x3dwc3,2,2022,positive
59,2/7/2023 20:25,imrjvic,"Outside of having the coolest entrance, does anyone else feel like our common room is bigger than the others? A lot of stairs going all over and the large main room with maybe like two or three more off it ?! 😍🤤🐍",,1,comment,x3dnv4,2,2022,positive
60,2/8/2023 11:59,imoyaar,slytherin entrance is the dopest among all,,24,comment,x3dnv4,2,2022,positive
61,2/8/2023 7:02,imt9c20,There's actual light! The first depiction of the Slytherin common room where studying is actually possible!,,1,comment,x3dnv4,3,2022,positive
62,2/8/2023 6:17,imor9rq,My home away from home.,,4,comment,x3dnv4,2,2022,neutral
63,2/8/2023 10:56,j6wxyim,Plot twist: OP will be 84 in 2030.,,2,comment,10rlqhe,2,2023,neutral
64,2/8/2023 14:11,j70y3oe,Im feeling like that just waiting for the release on 7th lol,,1,comment,10rlqhe,3,2023,neutral
65,2/10/2023 14:48,j6wes3c,![gif](giphy|26BRuo6sLetdllPAQ|downsized),,9,comment,10rlqhe,2,2023,neutral
66,2/10/2023 23:26,j6xv2ve,"I'm normally a patient gamer. I've usually got no issue waiting for the complete editions to be discounted 50 - 75%. But, I'm just really excited for this game so I preordered the deluxe edition so I could play 3 days early. Do what makes you happy.",,2,comment,10rlqhe,3,2023,positive
67,2/8/2023 9:18,ti6fvj,Here we go again...,129,599,post,,3,2022,negative
68,13/2/2023 12:29,i16kx87,LETS GOO but then again I also heard this or something similar about BF2042 and we all know how that went lol,,1,comment,tgmsjm,3,2022,positive
69,2/8/2023 0:12,i132v58,"I truly can't believe people thought that they would put microtransactions in a game like this, it just wouldn't work and would be pointless.",,2,comment,tgmsjm,3,2022,negative
70,2/8/2023 23:23,i133wo3,THIS GAME IS GONNA BE SO GOOD.,,3,comment,tgmsjm,3,2022,positive
71,2/8/2023 3:30,i14ep6l,"For some reason, this post preview is now showing up to me as ""This Tweet has been deleted"" and I was so \*\*\*\*\*\* nervous that Chandler had to take it back or something. But yeah it's not deleted, thank gods",,1,comment,tgmsjm,3,2022,neutral
72,2/8/2023 6:56,i2d8n2c,I really like the Ravenclaw.,,3,comment,tps68g,3,2022,positive
73,2/9/2023 7:39,i2frk6u,Love em!!,,2,comment,tps68g,3,2022,positive
74,2/9/2023 13:37,i2ple87,I love these!!  Are these just concept or can these be purchased?,,2,comment,tps68g,3,2022,positive
75,2/8/2023 6:52,i2d5m8k,"shit, i think i may have splooged",,0,comment,tps68g,3,2022,neutral
76,2/8/2023 17:41,i1diujq,I'm at least going to wait for the digital preorder,,1,comment,ti6fvj,3,2022,neutral
77,2/8/2023 15:34,i1d0qid,we waited years. we can wait a week until the steam reviews arrive.,,2,comment,ti6fvj,3,2022,neutral
78,2/8/2023 14:40,i1cfpu6,I'm gonna pre-order for faster download. Also I'm pretty confident they'll deliver from what I've seen and honestly if they fall short I can forgive them because it's a genuine attempt at a game I've dreamt about for years.,,1,comment,ti6fvj,3,2022,positive
79,2/8/2023 8:26,i1h2nw3,I think you should leave the idea of pre-ordering behind and wait for the final product… Is that so hard?,,0,comment,ti6fvj,3,2022,negative
80,2/8/2023 13:18,i1z0fbt,Centaurs will fight (alongside?) you and have different coat colors? Amazing,,40,comment,tmwsu5,3,2022,neutral
81,2/8/2023 13:01,i1zayhx,"I’m happy with this. Shows that they’re polishing bugs, so by Holiday Season, most of them (especially the major ones) should be gone.",,4,comment,tmwsu5,3,2022,positive
82,2/8/2023 9:12,i1zaevt,"That is one heck of a bug xD

 I'm actually a lot more interested in what the MC did though. Everyone noticed the new spells but I'm more interested in that weird...flick he did in between. He sort of flicked his wand and sparks came out...like he was 'reloading' it? He did it right after firing off two spells and right before firing off a different spell. I wonder if that's a hint of a possible spell cooldown system or if that's the animation of 'switching spells'.

I'm really thirsty on more info on the gameplay.",,13,comment,tmwsu5,3,2022,negative
83,2/8/2023 20:57,i22q0kl,That centaur needs a generous helping of Skele-Gro,,2,comment,tmwsu5,3,2022,neutral
84,2/8/2023 11:26,i0m9suy,Finally. God damn.,,29,comment,tdy8ad,3,2022,positive
85,2/7/2023 9:35,i0md5lt,THAT LITTLE SNIPPET OF NEW GAMEPLAY IN THE TWITTER POST 😩🤚 it looks so good,,18,comment,tdy8ad,3,2022,positive
86,2/7/2023 11:51,i0nvpm7,Im so pumped!,,1,comment,tdy8ad,3,2022,positive
87,2/7/2023 9:00,i0pygky,#LETS FUCKING GOOOOOOOOOO,,1,comment,tdy8ad,3,2022,positive
88,2/7/2023 10:11,i1ipc1k,"So fascinated by all of these theories and ""what ifs""! Its all part of the fun for me.",,17,comment,tj8sbt,3,2022,positive
89,2/7/2023 9:44,i1ip6ex,Charms master looks more Indian than black. He's not a Shacklebolt.,,7,comment,tj8sbt,3,2022,neutral
90,2/7/2023 9:03,i1im5us,"The Charms teacher is Indian; Shacklebolt described as African. The clothes might look similar at first glance but they're not, really.",,12,comment,tj8sbt,3,2022,neutral
91,2/7/2023 9:20,i1itxnh,"For me the deputy headmistress is the headmistress, she also shows MC the room of requirement. Also tons of Ms Cackle vibes. Haha.",,1,comment,tj8sbt,3,2022,neutral
92,2/7/2023 10:46,i1gn0k5,"Ragnok attacks muggles to expose wizards cause they won't give in to his demands, mc's parents dye and he suddenly uses ancient magic to save self, ragnok sees, fig takes him to acie t magic sight to test theory on mc's power, taken to gringos to get money to buy wand from dragon alley",,3,comment,tiiqvv,3,2022,neutral
93,2/7/2023 14:44,i1eq8fc,"The carriage scene is imo definitely part of the opening sequence (or at least the beginning of the game) since it's dated from September 1st, which is arguably the start of the game, the start of a the Hogwarts year. However just because the MC isn't wearing a school robe in other sequences doesn't mean those sequences take place at the same time. We've been shown that the player can change their attire at any point, except in classes I'm assuming, where you'll be required to wear formal robes. I'm not really buying that you will be allowed to roam the world on a broom before even going to Hogwarts.",,11,comment,tiiqvv,3,2022,neutral
94,2/7/2023 14:52,i1edr3s,"I think professor figg might be the runes professor because our mc has the power to sense ancient magic or whatever, it might be why he's so interested in our mc",,22,comment,tiiqvv,3,2022,neutral
95,2/7/2023 9:01,i1e4uap,"I feel like the minecart scene also takes place before you get to Hogwarts. My personal prediction on the order of events: character creation at home, some major event happens, Fig steps in taking you to the first site of ancient magic, Goblins attack awakening your ancient magic, Fig enrolls you in Hogwarts and takes you to Gringotts to get a wand and the needed stuff.",,148,comment,tiiqvv,3,2022,neutral
96,2/7/2023 13:54,u3frjy,The amazingly kind people from WBGames and Avalanche Studios sent me a poster!!,101,1833,post,,4,2022,positive
97,2/7/2023 9:16,ij6w388,I wish you the best of health and I hope you can beat this !!!,,2,comment,u3frjy,6,2022,positive
98,2/7/2023 8:59,i4re5bp,This is really cool. Rooting for you :)),,1,comment,u3frjy,4,2022,positive
99,2/7/2023 9:46,i4pweh3,"Congrats! What a nice gesture from them !

 Wish you all the Best ❤️",,4,comment,u3frjy,4,2022,positive
100,2/7/2023 16:06,i4qa37g,"This is an awesome and much deserved gift.

I hope all the positivity this community has to muster offers the magic needed to bring you many, many years of joy exploring all that Hogwarts has to offer.

What ever house you belong to, you will always have the support of this Ravenclaw.",,4,comment,u3frjy,4,2022,positive
101,2/7/2023 13:08,iiusi6y,Poor hippogriff D:,,12,comment,wflpsc,4,2022,neutral
102,2/7/2023 11:30,iixgsyh,beautiful 15fps,,1,comment,wflpsc,4,2022,negative
103,2/7/2023 10:04,iivjjeh,Ahhhhhh! This looks way too cool.,,3,comment,wflpsc,4,2022,positive
104,2/7/2023 8:58,iiunodv,"What about that image with a release date. Should that be taken serious? 

I doubt the date would be released in such a way.",,17,comment,wflpsc,4,2022,neutral
105,2/8/2023 8:10,i95xylu,This is my dream come true 😍,,3,comment,usjsx4,5,2022,positive
106,2/8/2023 3:53,i974w5b,"Good, this leaves me confident! If they have time to release this (I know it doesn't take much effort to render this when you've already built it), it means they are probably pretty happy with their product, at least environmental design-wise.",,2,comment,usjsx4,5,2022,positive
107,2/8/2023 8:50,i93v7fb,That watering can at 10:00 is rather effective.,,73,comment,usjsx4,5,2022,neutral
108,2/8/2023 2:45,i93xn94,[removed],,94,comment,usjsx4,5,2022,neutral
109,2/8/2023 21:48,i9wn4e5,this looks concerning,,6,comment,uwusmk,5,2022,neutral
110,2/8/2023 1:45,i9unxpb,Not gonna lie the lackluster looking combat helped tone down my excitement.,,5,comment,uwusmk,5,2022,negative
111,1/8/2023 23:40,ia2dejw,Not a fan of the stiff robe. And the AI seems kinda bad. It seems like only one ai will attack at a time and all the others just stand there stupidly. The one on the left keeps walking into the tree. Combat also looks stiff and doesn’t flow nicely,,5,comment,uwusmk,5,2022,negative
112,2/8/2023 23:08,i9uktx5,lmao at the dude walking into the tree,,131,comment,uwusmk,5,2022,neutral
113,2/11/2023 18:29,vicgcz,Another tweet showing different outfits for our character and NPCs,79,307,post,,6,2022,neutral
114,2/8/2023 21:33,ij6oh46,Man you deserve everything for how strong you are. I’m so glad your recovery is going well.,,119,comment,whofud,6,2022,positive
115,2/9/2023 0:30,ij7hzdx,"Never give up my friend, I wish you from the bottom of my heart all the best and a speedy recovery",,1,comment,whofud,7,2022,positive
116,2/8/2023 20:20,ijn1eti,"Thank you for the update! Glad to hear the surgery recovery is going well, and here's hoping for the best when it comes to hearing news back on the tumor. Stay strong!",,21,comment,whofud,10,2022,positive
117,2/8/2023 15:41,ij7crz7,"My fellow Gryffindor, I'll be waiting for you in the Great Hall so we can walk in together. Wands at the ready......you got this!",,7,comment,whofud,7,2022,positive
118,2/8/2023 19:35,idcz7hn,"I’m more impressed with the eye movements, holy crap the way the eyes focus on the “camera” and flick back is amazing.",,91,comment,vicgcz,6,2022,positive
119,2/8/2023 19:05,idjys01,male MC variant at 0:21 reminds me of Christian Coulson's Tom Riddle from the CoS movie...,,1,comment,vicgcz,6,2022,neutral
120,2/9/2023 10:43,idd2cgj,"The eyes look so much better than the footage we had seen before, I’m really excited to see that improvements are still being made!!",,46,comment,vicgcz,6,2022,positive
121,2/9/2023 2:50,idgfqi6,The characters look quite good,,3,comment,vicgcz,6,2022,positive
122,2/8/2023 8:26,i7mcvzx,"I was thinking the spell was shown off in a cut scene because it's the first time you cast it. It could be a finisher though yeah. 

My thought was it would depend how combat works. I would assume you just can't cast spells at teachers and classmates? Not sure but I would assume they just limit that entirely. 

In terms of combat balance, away I thought which I think sounds cool is making a spell weaker if you spam it. Different spells could be more or less effected by this. So Avada Kedavra would be after casting it once but Stupefy could be casted freely. In terms of the spell being weaker maybe it has a lessened effect or maybe it's easier to block. 

This would mean weaving different spells is rewarding rather than spamming the same spell over and over. Just a thought probably not what they will do.",,1,comment,ujvrfh,7,2022,neutral
123,2/8/2023 19:25,i7npy0j,"Still seeing people who think they will be able to run amok in the school.

Not going to happen. This will not be GTA Hogwarts Edition.",,6,comment,ujvrfh,7,2022,neutral
124,2/9/2023 9:16,i7loh13,Imagine being able to AK your fellow students freely.,,1,comment,ujvrfh,7,2022,neutral
125,2/8/2023 21:02,i7npszn,"There’ll be restrictions on it sure. Probably late game spell and only able to be used on certain enemies in certain situations probably only in battle outside of Hogwarts.

It won’t necessarily be illegal to cast, as the spell has been legalised before (for use by certian Ministry officials), but it will probably be only used in a few situations. If NG+ is an option, it’ll probably be used heavily in NG+ rather than the first play through",,1,comment,ujvrfh,7,2022,neutral
126,2/8/2023 23:35,ii0qbmm,SUMMON RELEASE DATE,,18,comment,waf7jl,7,2022,neutral
127,2/8/2023 17:24,ii3tgrs,It's been a while since I was this excited for a game. Finally something fresh and interesting to look forward to!,,5,comment,waf7jl,7,2022,positive
128,2/8/2023 14:14,ii1r1cp,Randomly wonderful,,4,comment,waf7jl,7,2022,positive
129,2/9/2023 13:42,ii0jzy4,Mozart's Lacrimosa! Love it 🥀,,154,comment,waf7jl,7,2022,positive
130,2/8/2023 9:33,wya2cn,"Hogwarts Legacy now banned on Steam Russia, Belarus, and Turkey.",202,329,post,,8,2022,negative
131,2/8/2023 14:41,ilt8lzs,"This is honestly really concerning. First you have the game being pushed back by almost half a year which is always a bad sign. Next you have the latest trailer with the lower quality facial animations from the original revel showcase. Now you have these insane recommended specs for a game that is pretty basic looking visually meaning its an non-optimized mess. On top of all of that you have the terrible way pre-ordering is being pushed. Not sure how I am feeling anymore, seems like this game is putting up alot of flags it might be a bust. Will not be pre-ording as planned waiting till I see some reviews forsure.",,7,comment,wxjuzx,8,2022,negative
132,2/8/2023 23:20,ilrhruc,"Lol, I won't run this game very well",,15,comment,wxjuzx,8,2022,negative
133,2/8/2023 20:21,ilrilyv,"Wow, too demanding, my 5 year old PC won't be able to handle the game. PS5 it is then.",,5,comment,wxjuzx,8,2022,negative
134,2/8/2023 8:48,iuo9ax9,"My laptop won't run this smoothly unless all the display settings are on low.

I have GTX 1650 ;u ;",,2,comment,wxjuzx,2,2022,negative
135,2/8/2023 7:00,iljic75,"What a joke lmao. $500 for a floating wand lol.


Also it says life size but to who. That want looks awfully short. I wouldn’t be surprised if the actual book itself is on the smaller size as well.",,49,comment,ww6gs9,8,2022,negative
136,2/9/2023 0:52,iljvxwo,"https://twitter.com/FinchStrife/status/1562285701126795264?s=20&t=fD7js5wNWMj1WOfjBYw29Q

Confirmed as 300 USD by Chandler Wood",,33,comment,ww6gs9,8,2022,neutral
137,2/8/2023 4:02,ilkscho,This is probably the shittiest bar fallout CE I've ever seen lmfao holy,,5,comment,ww6gs9,8,2022,negative
138,2/8/2023 6:50,iljk9p3,"Seems the leak was right then, hope its a reasonable price

EDIT: Just saw the price and while not USD 500 AUD, are they out of their minds?",,13,comment,ww6gs9,8,2022,negative
139,2/8/2023 8:47,ilw304s,Does this means there’s gays ™ in the game?,,2,comment,wya2cn,8,2022,neutral
140,2/8/2023 6:29,im25vag,Hey mods. A lot of Russian apologists in the comments. There can be zero tolerance for this. The position to support Ukraine must be made clear here.,,-1,comment,wya2cn,8,2022,negative
