,created,id,content,num_comments,score,type,post_affiliation,month,year,sentiment
141,2/8/2023 13:11,ilvia17,"What is your source that the game is banned in Turkey? Because this is simply not true. Turkish currency is very fluctuating, as a result, region hoppers abuse the cheaper prices. That's why quite a few (not all) companies lately only open the pre-order a day or two before the game releases. The same applies here as well. Lots of companies are also updating their prices on the Turkish market due to inflation.",,34,comment,wya2cn,8,2022,negative
142,2/8/2023 17:21,ilwv0d8,"Chandler has said this ""For those in Turkey, Pre-Orders for Hogwarts Legacy will go live in this region soon.""",,1,comment,wya2cn,8,2022,neutral
143,2/8/2023 10:40,ilfnx5x,eeeeeeeeeeeeeeeeeeeeeeeeeeee,,2,comment,wvj55z,8,2022,neutral
144,2/8/2023 9:15,ilh5jfp,The two wallpapers seem to show two different battles of hogwarts eh? One with an army of dark creatures. Both feature dragons thoooo,,2,comment,wvj55z,8,2022,neutral
145,2/8/2023 9:12,ilfjp81,I hope trailer means gameplay here.,,23,comment,wvj55z,8,2022,neutral
146,2/8/2023 8:21,ilfkjek,"I think we might see the darker side of this game!

While the SOP showed some monsters, we haven't truly seen how dark/scary this game could be. First the spider hint and thab yetserday the tomb with the creepy music. And now on that poster we see Inferi, dementors and dragons in a creepy setting. This going to be so cool!

I think that we'll see gameplay of a mission were our character sneaks out at night, goes into the forbidden forest and tries to find a tomb with a treasure inside! We'll probably see the HUD they will show us how to switch spells to fight different monsters.",,53,comment,wvj55z,8,2022,neutral
147,2/8/2023 4:52,ik0m3u1,*Sad Hedwig Noises*,,12,comment,wmowau,8,2022,neutral
148,2/9/2023 2:48,ik0ga0s,Holy f*ck that's my birthday lol,,321,comment,wmowau,8,2022,positive
149,2/9/2023 1:21,ik0fij1,"The Holiday announcement was simply a really unwise thing to do if they clearly must have had a bunch of bug fixing in front of them and still do. They won't change massive stuff with two months more time. As others have stated before, this was not unexpected but certainly isn't the best sign for the state of the game right now.

I can only urge people not to preorder before we have information on the state of the game.",,34,comment,wmowau,8,2022,negative
150,2/9/2023 0:16,ik0lx8f,[This is my fault. ](https://www.reddit.com/r/Games/comments/wltkx0/z/ijwyawe),,7,comment,wmowau,8,2022,neutral
151,2/8/2023 11:00,ilv2hjx,Omfg lol,,1,comment,wy4607,8,2022,neutral
152,2/8/2023 8:11,ilvd7u7,You know it's a rubbish CE when they are all still available online.,,9,comment,wy4607,8,2022,negative
153,2/8/2023 19:32,ily28fv,My father will hear about this and will provide me with a PS5 asap,,1,comment,wy4607,8,2022,positive
154,2/8/2023 20:45,ilw6ray,"I LOVE this, I mean those facial expressions in the final panel is how I see the players (myself included) after hearing about all the crazy exclusives trapped behind different platforms.",,1,comment,wy4607,8,2022,positive
155,2/9/2023 2:04,xg7yhb,The spiders are not lore breaking if they are in the game. It’s not a big deal.,91,328,post,,9,2022,neutral
156,2/8/2023 21:05,ijkeczc,Gryffindor Common Room!,,9,comment,wjzm4p,9,2022,positive
157,2/8/2023 10:49,ijtu3q0,Dumbledores sex dungeon,,0,comment,wjzm4p,11,2022,neutral
158,2/8/2023 18:56,ijkuflj,Imagine cleaning this room without magic.,,2,comment,wjzm4p,9,2022,neutral
159,2/8/2023 13:52,ijnj997,This is the Chamber of Secrets.,,4,comment,wjzm4p,10,2022,neutral
160,2/8/2023 17:10,ios4oaq,*confirmed by Horny Potter*,,3,comment,xg7yhb,9,2022,neutral
161,2/9/2023 0:18,iory9xn,Was it worth drawing in the book,,-3,comment,xg7yhb,9,2022,neutral
162,2/9/2023 0:30,ioqrh94,The game takes place way before this book was written though (and before the colony was established),,1,comment,xg7yhb,9,2022,neutral
163,2/8/2023 12:38,ioriz4s,The question is: there are just Acromantula or maybe more species are existing?,,2,comment,xg7yhb,9,2022,neutral
164,2/9/2023 0:09,ipuldgc,"Personally i wouldnt go for Skyrim, since its a massive game and theres so much to do you'll lose track as a non gamer. Try a more linear game thats still an RPG and not that big of an openworld since its mostly just hubs like the Fable series",,1,comment,xn7mdi,9,2022,neutral
165,2/8/2023 15:13,ips9k0x,I’ve noticed that you have the illustrated editions of HP and I wanted to ask you if they are worth it or not. Either way they look absolutely beautiful on the shelf!,,11,comment,xn7mdi,9,2022,positive
166,2/8/2023 11:09,iq3b00w,"Honestly you don't need to play anything in advance to be ""skilled enough"" to play Hogwarts -if anything I suggest Fable and Skyrim and Fallout -but the theme here is RPG.  


Sure there are other options and many more,but again you don't HAVE to play those.

I'm currently in between The Sims 4 and Dead by Daylight and picking up Valkyrie Elysium with some hesitation,but also wish I had something even more to play.  


Like I wish Forspoken was out next month,but that got delayed and if anything just bring on God of War and Pokemon.  


There arent alot of options for someone like me who has played a ton of games.  
Already bored to death of the new Saints Row Remake and really expected more but feel like I just had to swallow a Saints Row The Third remaster.  


For a non-gamer if anything ""Master"" that set -up like Good Job for getting that ""A"" out the way,that spot better be comfy because if you can't sit there for 6hrs.  


That's a fail . . .  


Also snack's is important -so how is that looking?  


I may make my Owl Butterbeer cupcakes for this and Dragon Eggs.",,1,comment,xn7mdi,9,2022,neutral
167,2/8/2023 13:40,ipsltzk,"Enjoy your new series x! It’s a beast of a console. 

There will likely be an easy difficulty setting with hogwarts legacy but Skyrim is a great game that has gotten even non gamers to play. Ever heard of Skyrim grandma? 

If you’re into the Greek mythology inspired monsters and beasts of the hp world I think Immortals Fenix Rising is also on game pass and it’s an open world game so it might get you in a hogwarts legacy mindset 

Someone else recommended mass effect and that’s a good series for getting into the dialogue choice aspects, well worth a play and you can set all these games on easy. Enjoy!",,4,comment,xn7mdi,9,2022,neutral
168,2/9/2023 2:20,iuo5gj6,"It's official, OP can't read",,1,comment,ye4m4x,2,2022,negative
169,2/8/2023 23:02,itz3qvs,He’s a community manager. He has 0 say in when it comes to potential delays,,4,comment,ye4m4x,10,2022,neutral
170,2/8/2023 21:50,ityvne4,"Chandler: no delay! 
The community: he didn’t say there would
be no delays",,5,comment,ye4m4x,10,2022,neutral
171,2/8/2023 16:28,itye74t,"He could have been more clear, but he's just saying that as of right now there are no delays. It doesn't mean there won't be in the future.",,-1,comment,ye4m4x,10,2022,negative
172,2/8/2023 20:54,isgb0wb,"I just want one walkthrough of a side quest showcasing raw gameplay. That's all I'm asking for and maybe a trailer showing the character creator. Other than that, I'm going blind from here on out.",,2,comment,y4u5jt,10,2022,negative
173,2/8/2023 12:06,isg0zi9,"I don’t really want any more story but i do want more insight into the mechanics/gameplay. They should show us the HUD, how casting works, what the inventory system is like, what perks do cosmetics/gear give, do we have access to brooms/mounts at any moment or only at certain points, how the day night cycle works, how classes work, etc. These things aren’t spoiling anything but will give us an idea of what to expect from how the game will play.",,40,comment,y4u5jt,10,2022,negative
174,2/8/2023 7:00,isg00rb,"Yes agreed, I have been trying to avoid anything until release since a few week",,0,comment,y4u5jt,10,2022,neutral
175,2/8/2023 10:04,isi2gvi,The only slightly concerning thing to me is the fact we've never seen the HUD. That's a red flag for me atm.,,2,comment,y4u5jt,10,2022,negative
176,2/8/2023 15:01,z10uc0,Do you want to be able to sit on furniture?,192,255,post,,11,2022,neutral
177,2/8/2023 14:29,irwj9d9,Yea because every redhead is automatically a Weasley. Speaking as a redhead myself I'd honestly be a little annoyed if it was,,1,comment,y0j117,11,2022,negative
178,2/8/2023 2:50,irtnwbx,"I’ll be shocked if they don’t throw a Weasley or two in there, it’s easy content. The Malfoys and Blacks as well.",,57,comment,y0j117,11,2022,negative
179,2/8/2023 22:44,iruthsp,Be funny if he starts the game rich and a side quest sees his family loose all their money.,,1,comment,y0j117,11,2022,neutral
180,2/8/2023 16:11,iru73eq,could just be scottish,,2,comment,y0j117,11,2022,neutral
181,2/9/2023 3:00,ix8p3lb,not at all people still thinking this is a school simulator and not an rpg i see,,9,comment,z10uc0,11,2022,neutral
182,2/8/2023 13:33,ixa0xo1,"Unfortunately I believe the game will not be our Legacy in the way they teased, nor a roleplay experience at all. It looks like they're making an action adventure genre game rather then an action rpg. We're going to get a big shift in genre of players here now because of it, the ones that just want to kill everything and race around in the shortest time possible being constantly active rather then stopping to smell the roses. which would be why the little things that feel more chill and relax style features many enjoy being able to do even if not constantly using will be looked down on and insulted now.

It would make me feel good to have an option to sit in a bench in a garden and just look at stuff going on around me, listen to a fountain etc. These little things are good for my soul and let me not feel so rushed in games.",,1,comment,z10uc0,11,2022,negative
183,2/8/2023 6:29,ixa6941,Yes please. I just wanna sit and look out at the grounds from one of the windows. Especially on a rainy night.,,20,comment,z10uc0,11,2022,neutral
184,2/8/2023 20:59,iypnjg8,How you gon release multiple asmr videos and not allow the player to sit on benches etc?,,3,comment,z10uc0,3,2022,neutral
185,2/8/2023 14:53,iynr7z6,just an asset that will be probably everywhere just like in any other game,,1,comment,z6cwzh,3,2022,negative
186,2/8/2023 14:20,iy12msx,"Could be repeated for the sake of not having to make as many assets, but as we know from the portraits of Headmaster Black, multiple portraits of the same person can be used as a sort of quick, long distance communication. Doesn’t answer who this is, only raises more questions, and is not based on any real evidence I can remember, but it is an idea.",,38,comment,z6cwzh,11,2022,neutral
187,2/8/2023 7:36,iy4059u,[removed],,1,comment,z6cwzh,11,2022,neutral
188,2/9/2023 2:23,iy12pug,Maybe she's just Ms. Placeholder and her portraits were put there only temporarily to fill the space.,,399,comment,z6cwzh,11,2022,neutral
189,2/8/2023 9:36,zw3vh8,"Anyone notice the river/lake isn't frozen over during the winter gameplay suggesting we need it to stay in liquid form.. *cough cough, diving quests*",139,355,post,,12,2022,neutral
190,2/9/2023 4:50,j049vaq,All that I want to see is Hogsmeade,,1,comment,zk80k6,12,2022,neutral
191,2/8/2023 5:36,izygl97,"Hold up.  The Unforgivables are SLOTTABLE SPELLS? I can definitely see dark green-colored spells behind the ESRB rating. The one at the top is Imperio and the one on the right has a skull, so it must be AK. The icon turns dark when the MC uses it.

How dare you give us so much power?",,29,comment,zk80k6,12,2022,neutral
192,2/8/2023 2:59,izyhqy9,"But there's only 12 months?!? 

I know it's unnecessary but I must register my annoyance with this date format.",,-3,comment,zk80k6,12,2022,neutral
193,2/9/2023 1:20,izyuxb7,Hopefully there will be some kind of confirmation soon that we can use the patronus charm in the game.,,4,comment,zk80k6,12,2022,neutral
194,2/9/2023 0:28,j0beqrw,Spend 500 on a new console. There will be other amazing games that will be new gen exclusives.,,2,comment,zlwc7g,12,2022,neutral
195,2/8/2023 22:17,j09i797,Pc,,4,comment,zlwc7g,12,2022,neutral
196,2/9/2023 3:16,j08p978,"I've loved my ps5. Ridiculously hard to get them, but really a great console",,3,comment,zlwc7g,12,2022,positive
197,2/8/2023 21:55,j07zm3s,"Ultimately, it's your choice. I may as well offer some advantages for the next-gen consoles, there'll lots of new games on there as well as upgrades to older ones that you may not have got around to playing. I had a PS4 and 6 months ago got a PS5 and have spent the time just catching up on most of the great Playstation games that I missed due to not being interested in them. God of War, Spider-Man Remastered, Death Stranding and so on.",,3,comment,zlwc7g,12,2022,neutral
198,2/9/2023 12:43,j1dx3k6,I'm 39... Lol,,4,comment,ztecaz,12,2022,neutral
199,2/9/2023 4:36,j1fwlfn,"My 45 year old husband has taken a week of vacation in February to play this game!  We both preordered, can't wait!",,4,comment,ztecaz,12,2022,positive
200,2/9/2023 1:30,j1embip,"Dude you are 32, enjoy your life ! Don't care about teenager or adult. Be an adult when you need to, but don't forget to enjoy little things like a child or a teenager !",,9,comment,ztecaz,12,2022,positive
201,2/9/2023 5:01,j1dlvxm,"30, been preparing for this game my whole life.",,8,comment,ztecaz,12,2022,positive
202,2/9/2023 5:11,j1ukadx,Meh… I think this might be reaching a little. But it is possible.,,2,comment,zw3vh8,12,2022,neutral
203,2/9/2023 2:21,j1x5x3i,Scotland rarely gets so cold for our lochs to completely freeze over,,2,comment,zw3vh8,12,2022,neutral
204,2/9/2023 4:41,j1tw7j1,I'm concerned that people are over hyping this game to extremes.,,15,comment,zw3vh8,12,2022,negative
205,2/9/2023 0:48,j1tvkt1,"There's snow up in the mountains, but not on the terrain. And the vegetation is still alive and thriving. Of course the water is not frozen!!

Underwater levels are usually super awkward. I hope we don't have diving quests.",,4,comment,zw3vh8,12,2022,neutral
206,2/9/2023 0:59,j0hlqxk,Ben was cute. Shut up.,,1,comment,zmiyxr,12,2022,positive
207,2/8/2023 22:27,j0bfb1m,"""Oh look!  Grass!  Amazing!  Wow!""  :P",,101,comment,zmiyxr,12,2022,positive
208,2/9/2023 5:36,j0f40ik,"Every time the guest opened his mouth I couldn’t stop cringing, dude was so hyped it felt forced and fake",,3,comment,zmiyxr,12,2022,negative
209,2/9/2023 4:16,j0bp3jt,"He was very hyper but I think he asked some good questions like if there’s different brooms we can get, if weather effects gameplay etc",,247,comment,zmiyxr,12,2022,neutral
210,2/9/2023 3:46,j8cai8e,I hate his voice it’s annoying af,,4,comment,110qs49,2,2023,negative
211,2/9/2023 4:07,j8bw64y,I guess he's doing quite a good job. LOL,,4,comment,110qs49,2,2023,positive
212,2/9/2023 5:36,j8brmc0,Yea he really is quite annoying. I always try and quickly leave when I hear him near me lol.,,2,comment,110qs49,2,2023,negative
213,2/8/2023 5:42,j8ednkn,"His random interactions can be kinda janky lol

I went through a doorway and he appeared when I got to the other side and started harassing some poor slytherin student. The problem was the doorway i went through was the portrait hole into the gryffindor common room. Seems Neville wasn't the first to leave the written passwords lying around...",,1,comment,110qs49,2,2023,negative
214,2/8/2023 1:46,j8c7wkj,all we have is the frogs really,,30,comment,110tcfb,2,2023,neutral
215,2/8/2023 4:03,j8eo7ot,It would be really cool if they added portkeys in random objects which didnt show up on revelio and when you activate them they took you to random easter egg locations from the movies.,,1,comment,110tcfb,2,2023,neutral
216,2/8/2023 6:01,j8c6p9y,"So many spots for a little portal or hidden staircase. 

The dark Arts tower is a masterclass in using space poorly. It's like 90% staircase and big hallway...where are the rooms and connectors? 

Soooooooo much of this game is atrium with no connected rooms. It's so fuckin weird. 

Like...the ENTIRE SECOND FLOOR OF TEH DARK ARTS TOWER IS JUST HALLWAY....what?!

Especially when a lot of the castle isn't even connected to other parts of the same building. 

Like ...you can't even see through the windows so they can do mostly whatever the fuck they want. 

Not sure why they made it so difficult to get around. 

Like you're telling me the hall of herodiana just goes in and out of a building and never connects to the actual core of the building? 

Also what's with SO many stairways to nothing....it's a videogame. Any door can lead to any place.

In general I feel the dungeons were super underutilized as well.


Like if there is one castle in all of gaming where a door can lead into a pocket dimension that doesn't line up with the exterior ..it is this castle.


If we can't even see outside...what's the fuckin point of lining it up?

The few times we do get secret areas it's just chest filler....or worse...a wall for the Hall of Herodiana side puzzle....like they made a whole ass room...so I could go into a wall to some generic cookie cutter room to do the actual puzzle?

Another example. Why is there no interior pathway between the history classroom area and the dark arts tower? They are one contiguous building but the only way between is the Transfiguration courtyard. Or go all the way around and up the exterior staircase through the pungent passage. 

Like not even a secret closet doorway or side staircase? The entire building is hallway?!

Also entire floors of buildings are like...one room and a staircase. It's just weird. 

Why make this big countryside when so much of the castle could still be expanded?

Ill hope a dlc builds it out more or the accrued assets from this game will help them in building it bigger in UE5 for the sequel.

Shame the hall of herodiana takes up so much wall space...lot of those could be used to connect to more castle for dlc. Now it's just this big fuckugly marble empty wall.",,4,comment,110tcfb,2,2023,negative
217,2/8/2023 1:48,j8avx1h,I agree. I think part of the issue is most of the main classrooms are so close to each other that it is hard for passageways to make sense.,,45,comment,110tcfb,2,2023,positive
218,2/8/2023 7:13,j8dopb3,"https://preview.redd.it/xew52dgqm0ia1.jpeg?width=2252&format=pjpg&auto=webp&v=enabled&s=a085674d3ff4c618963b4e9f9f81c310075ab5c1

Me too!",,1,comment,110wxq9,2,2023,neutral
219,2/8/2023 4:42,j8csvxr,I love this game. How many of us are being huge nerds and just playing as ourselves?,,13,comment,110wxq9,2,2023,positive
220,2/8/2023 1:48,j8ctssc,Damn how does your game look like that?? Mine’s always foggy and grey…,,8,comment,110wxq9,2,2023,negative
221,2/8/2023 11:02,j8bmy04,You have a kneazle!,,67,comment,110wxq9,2,2023,neutral
222,2/8/2023 1:55,10s5pqp,I did not play the game yet - AMA,164,396,post,,3,2023,neutral
223,2/8/2023 5:44,j718993,"If I want to can I leave the school, catch the train back to London and just walk around, browse the shops and stuff? I can't wait to visit Privet Drive in the 1800's.",,3,comment,10s5pqp,3,2023,neutral
224,2/8/2023 3:53,j6zmz7l,Can you swim underwater and romance mer-people?,,42,comment,10s5pqp,3,2023,neutral
225,2/8/2023 1:58,j6zmvt6,What's in the side corridor in the Room of Requirements?,,5,comment,10s5pqp,3,2023,neutral
226,2/8/2023 4:18,j70224j,Does it take place in America?,,1,comment,10s5pqp,3,2023,neutral
227,2/8/2023 1:54,j2t0enx,When you find out there's a day of school when it drops ❤️❤️,,1,comment,10261p8,4,2023,neutral
228,2/8/2023 1:55,j2t640q,My friends proposed we take a road trip starting the weekend it comes out. I’m trying everything i can to convince them to go in march or april instead without mentioning it’s because i wanna spend my free time playing this game in feb instead lol,,10,comment,10261p8,4,2023,neutral
229,2/8/2023 2:01,j2ud7ud,Yep going to Europe for the whole month of February,,2,comment,10261p8,4,2023,neutral
230,2/8/2023 3:06,j2uv754,"Nah, I'll still be working, but I got the day off on the 8th, so I can play all day then.",,1,comment,10261p8,4,2023,positive
231,2/8/2023 1:47,j6xvt67,New Zealand. Hufflepuff.,,15,comment,10rty14,3,2023,neutral
232,2/8/2023 1:59,j6xly9a,"Brazil,  Ravenclaw",,28,comment,10rty14,3,2023,neutral
233,1/9/2023 0:13,j6xo1ev,Brazilian Hufflepuff speaking! 😉,,54,comment,10rty14,3,2023,neutral
234,1/9/2023 2:23,j6xmzil,"Brazil, Hufflepuff",,11,comment,10rty14,3,2023,neutral
235,1/9/2023 8:35,102tom9,It’s crazy how much Cyberpunk has affected people when it comes to game releases,233,287,post,,4,2023,negative
236,1/9/2023 3:15,j78bacc,I'm playing as the teenager version of myself so this will definitely help with the immersion,,221,comment,10te7cx,5,2023,positive
237,1/9/2023 5:05,j78vueo,They are kids So it makes sense. But they should have had a best friend option.,,2,comment,10te7cx,5,2023,neutral
238,1/9/2023 0:56,j76aj5e,"I’m kind of glad Avalanche isn’t opening themselves up to attack by adding romance options (because we all know there are people looking for any excuse to drag this game through the mud). 

At the same time, I don’t think very mild romance would have been a problem and it could have been rather sweet if done right. A good romance story doesn’t even need the characters to kiss (Pride and Prejudice!). Who doesn’t find the Stranger Things romances rather endearing and sweet to watch unfold, even as an adult? 

So maybe a little disappointed? But at the same time, if the companion friendships are well fleshed out then this may well fill that gap just fine.",,439,comment,10te7cx,4,2023,neutral
239,1/9/2023 0:49,j78bqsu,Just Sadge 😭😭😭,,3,comment,10te7cx,5,2023,neutral
240,1/9/2023 7:08,j76mx4j,no spoilers but has anything really surprised/wowed you?,,78,comment,10tgnrn,4,2023,neutral
241,1/9/2023 6:44,j7796re,Being good or evil makes a small or big difference on the story?,,4,comment,10tgnrn,5,2023,neutral
242,1/9/2023 11:31,j76kknq,"Have you unlocked the talent system? If so, how is it?",,54,comment,10tgnrn,4,2023,neutral
243,1/9/2023 3:43,j76nhdi,How much can the HUD customized? Can the white outline around objects/enemies be turned off?,,14,comment,10tgnrn,4,2023,neutral
244,1/9/2023 6:28,j2w5z26,"Don't know where that comes from because everywhere I look people are absolutely hyped about this game.

I loved Cyberpunk even on release but CDPR oversold / under-delivered and some people learned from that experience.",,4,comment,102tom9,4,2023,neutral
245,1/9/2023 7:42,j2vwhxe,"Hasn’t ruined it enough. People are, will, and always will continue to fall for hype.

People are falling for hype here too. But it’s getting checked by a lot of people, even if it upsets a few people who want to let their imagination run wild.

That’s how we’re going to avoid another Cyberpunk.

Cyberpunk had unchecked hype. This game has a lot of people who were burnt by Cyberpunk and trying to check hype to prevent another Cyberpunk from
happening. And they’re still getting hated on.

It’s a thankless job.",,-2,comment,102tom9,4,2023,negative
246,1/9/2023 2:46,j2vek6z,"Definitely completely different scenarios. 

This game has shown off a decent amount and isn't promising more than what they've shown, they've actually tried to contain hype by answering questions. What is and isn't in the game, what you can expect from the world, etc. They're not even saying don't be hyped because I absolutely am, it's just looking like a pretty standard action adventure RPG, and that's not a bad thing. 

With Cyberpunk they oversold and underdelivered hard. But most of that is because of upper management. We now know they were crunching hard this whole time, it seems like the vision changed while it was in development, and by having to also make it for last gen systems they couldn't fully take advantage of the new systems and mechanics. Even at launch we still didn't really know what the game was trying to be. 

That's not happening with Hogwarts Legacy. The game has a clear vision and goal, the gameplay is defined to what they want, the world is how they envisioned it and every little detail looks like a love letter to the franchise. It's looking like a very solid game that at the very least is gonna be great. 

The only way people will be disappointed on the level of Cyberpunk is if they go in expecting this game to be something it was never said to be. As long as you're not worrying about why parrying creates a bubble over you, this game is looking to be a fun experience that's worth the hype.",,84,comment,102tom9,4,2023,positive
247,1/9/2023 8:32,j2xiewx,It’s just annoying because we can’t even have a conversation of any type without somebody jumping in ***BuT cYBerPuNk*** lol doesn’t matter the game type or format or console I’m over it,,2,comment,102tom9,5,2023,negative
248,1/9/2023 14:08,j7bqpzd,Anyone else see the word builders an think BOB?,,2,comment,10tzh71,6,2023,neutral
249,1/9/2023 13:50,j79nwxi,Cool post,,8,comment,10tzh71,5,2023,positive
250,1/9/2023 2:00,j7bp1h6,Really weird that the game supposedly won't have a Respec potion to use. Haha even Witcher 3 has a Respec potion that we can buy,,2,comment,10tzh71,6,2023,negative
